C1: Sluttresultat Hurtigsjakk 1998
D2: 1 | E2: 2 | F2: 3 | G2: 4 | H2: 5 | I2: 6 | J2: 7 | K2: 8 | L2: 9 | M2: 10 | N2: Sum | P2: Hovedside
B3: ----------------------------------------------------------------------------------------------------------------------- | P3: Hovedside turneringer
A4: 1 | B4: Holm,R. | D4: 15 | E4: 15 | F4: 15 | G4: 15 | H4: 15 | I4: 15 | J4: 15 | K4: 15 | L4: 12 | M4: 12 | N4: =SUM(D4:M4) -> 144
A5: 2 | B5: Brobakken,G. | D5: 15 | E5: 12 | F5: 12 | G5: 12 | H5: 12 | I5: 12 | J5: 10 | K5: 10 | L5: 10 | M5: 9 | N5: =SUM(D5:M5) -> 114 | P5: 1999
A6: 3 | B6: Jotun,J. | D6: 15 | E6: 15 | F6: 10 | G6: 10 | H6: 10 | I6: 10 | J6: 10 | K6: 10 | L6: 10 | M6: 9 | N6: =SUM(D6:M6) -> 109
A7: 4 | B7: Nilsen,T. | D7: 15 | E7: 15 | F7: 15 | G7: 12 | H7: 12 | I7: 12 | J7: 7 | K7: 6 | L7: 5 | M7: 4 | N7: =SUM(D7:M7) -> 103
A8: 5 | B8: Ormåsen,O.S. | D8: 12 | E8: 12 | F8: 12 | G8: 10 | H8: 10 | I8: 9 | J8: 8 | K8: 8 | L8: 7 | M8: 6 | N8: =SUM(D8:M8) -> 94
A9: 6 | B9: Svingen,P. | D9: 10 | E9: 10 | F9: 9 | G9: 9 | H9: 9 | I9: 9 | J9: 9 | K9: 8 | L9: 7 | M9: 6 | N9: =SUM(D9:M9) -> 86
A10: 7 | B10: Kristiansen,R. | D10: 15 | E10: 15 | F10: 12 | G10: 8 | H10: 7 | I10: 7 | J10: 7 | K10: 5 | L10: 3 | M10: 2 | N10: =SUM(D10:M10) -> 81
A11: 8 | B11: Frydendal,O. | D11: 15 | E11: 12 | F11: 9 | G11: 9 | H11: 9 | I11: 7 | J11: 6 | K11: 5 | L11: 5 | M11: 2 | N11: =SUM(D11:M11) -> 79
A12: 9 | B12: Leine,K. | D12: 12 | E12: 10 | F12: 9 | G12: 8 | H12: 8 | I12: 7 | J12: 7 | K12: 7 | L12: 6 | M12: 5 | N12: =SUM(D12:M12) -> 79
A13: 10 | B13: Andresen,T. | D13: 15 | E13: 15 | F13: 12 | G13: 9 | H13: 9 | I13: 9 | J13: 8 | N13: =SUM(D13:M13) -> 77
A14: 11 | B14: Nordstrøm,S. | D14: 8 | E14: 8 | F14: 7 | G14: 7 | H14: 6 | I14: 5 | J14: 5 | K14: 5 | L14: 5 | M14: 4 | N14: =SUM(D14:M14) -> 60
A15: 12 | B15: Hozori,Y. | D15: 15 | E15: 10 | F15: 8 | G15: 8 | H15: 6 | I15: 4 | J15: 3 | K15: 3 | N15: =SUM(D15:M15) -> 57
A16: 13 | B16: Nygård,P.J. | D16: 12 | E16: 8 | F16: 6 | G16: 6 | H16: 6 | I16: 4 | J16: 4 | K16: 4 | L16: 4 | M16: 3 | N16: =SUM(D16:M16) -> 57
A17: 14 | B17: Holenbakken,E. | D17: 9 | E17: 9 | F17: 9 | G17: 6 | H17: 6 | I17: 2 | N17: =SUM(D17:M17) -> 41
A18: 15 | B18: Bie, B. | D18: 15 | E18: 10 | F18: 10 | G18: 2 | N18: =SUM(D18:M18) -> 37
A19: 16 | B19: Larsen, B | D19: 12 | E19: 12 | F19: 12 | N19: =SUM(D19:M19) -> 36
A20: 17 | B20: Mortensen,M. | D20: 9 | E20: 9 | F20: 5 | G20: 4 | H20: 3 | I20: 3 | J20: 2 | K20: 1 | N20: =SUM(D20:M20) -> 36
A21: 18 | B21: Svendby,T. | D21: 8 | E21: 6 | F21: 5 | G21: 4 | H21: 4 | I21: 3 | J21: 2 | K21: 1 | L21: 1 | M21: 0 | N21: =SUM(D21:M21) -> 34
A22: 19 | B22: Pettersen, H | D22: 15 | E22: 10 | N22: =SUM(D22:M22) -> 25
A23: 20 | B23: Pettersen,R. | D23: 9 | E23: 8 | F23: 8 | N23: =SUM(D23:M23) -> 25
A24: 21 | B24: Skåret,O.V. | D24: 9 | E24: 6 | F24: 5 | G24: 4 | N24: =SUM(D24:M24) -> 24
A25: 22 | B25: Kristiansen,O.J | D25: 8 | E25: 7 | F25: 7 | G25: 2 | N25: =SUM(D25:M25) -> 24
A26: 23 | B26: Saxrud, D | D26: 12 | E26: 5 | F26: 3 | G26: 3 | H26: 0 | I26: 0 | N26: =SUM(D26:M26) -> 23
A27: 24 | B27: Bakken, S.A. | D27: 12 | E27: 4 | F27: 3 | G27: 2 | N27: =SUM(D27:M27) -> 21
A28: 25 | B28: Løberg,O. | D28: 8 | E28: 7 | F28: 6 | N28: =SUM(D28:M28) -> 21
A29: 26 | B29: Hoff,N. | D29: 10 | E29: 9 | N29: =SUM(D29:M29) -> 19
A30: 27 | B30: Brekstad, K | D30: 10 | E30: 5 | F30: 3 | N30: =SUM(D30:M30) -> 18
A31: 28 | B31: Jevne, R | D31: 7 | E31: 7 | N31: =SUM(D31:M31) -> 14
A32: 29 | B32: Stenvaag,P.C. | D32: 8 | E32: 3 | N32: =SUM(D32:M32) -> 11
A33: 30 | B33: Pilø,L. | D33: 7 | N33: =SUM(D33:M33) -> 7
A34: 31 | B34: Benjaminsen, T | D34: 7 | N34: =SUM(D34:M34) -> 7
A35: 32 | B35: Brobakken,O. | D35: 6 | E35: 1 | F35: 0 | G35: 0 | N35: =SUM(D35:M35) -> 7
A36: 33 | B36: Fikke, E. | D36: 5 | E36: 0 | N36: =SUM(D36:M36) -> 5
A37: 34 | B37: Akslen, K | D37: 3 | E37: 2 | F37: 0 | G37: 0 | N37: =SUM(D37:M37) -> 5
A38: 35 | B38: Knutsen, D | D38: 3 | E38: 2 | N38: =SUM(D38:M38) -> 5
A39: 36 | B39: Lie, E. | D39: 4 | N39: =SUM(D39:M39) -> 4
A40: 37 | B40: Engebakken, T | D40: 2 | N40: =SUM(D40:M40) -> 2