B2: POENGJAKT HURTIGSJAKK 2004
E4: Sluttresultat
E6: Åpen klasse
B8: Nr. | C8: Navn | D8: 1 | E8: 2 | F8: 3 | G8: 4 | H8: 5 | I8: 6 | J8: 7 | K8: 8 | L8: 9 | M8: 10 | N8: SUM
B9: 1 | C9: Jotun,J. | D9: 15 | E9: 15 | F9: 10 | G9: 10 | H9: 9 | I9: 8 | J9: 8 | K9: 8 | L9: 6 | M9: 2 | N9: =SUM(D9:M9) -> 91
A10: 2003 | B10: 2 | C10: Hoff, N | D10: 15 | E10: 15 | F10: 12 | G10: 10 | H10: 9 | N10: =SUM(D10:M10) -> 61
A11: 2005 | B11: 3 | C11: Nerland, T | D11: 15 | E11: 12 | F11: 10 | G11: 9 | H11: 7 | I11: 4 | J11: 3 | N11: =SUM(D11:M11) -> 60
B12: 4 | C12: Brobakken,G. | D12: 12 | E12: 12 | F12: 9 | G12: 8 | H12: 7 | I12: 5 | J12: 5 | N12: =SUM(D12:M12) -> 58
A13: Hovedside turneringer | B13: 5 | C13: Holm,R. | D13: 15 | E13: 15 | F13: 15 | G13: 12 | N13: =SUM(D13:M13) -> 57
B14: 6 | C14: Nilsen,T. | D14: 12 | E14: 10 | F14: 10 | G14: 10 | H14: 8 | I14: 7 | N14: =SUM(D14:M14) -> 57
A15: 38001 | B15: 7 | C15: Ormåsen,O.S. | D15: 12 | E15: 10 | F15: 8 | G15: 8 | H15: 6 | I15: 5 | J15: 3 | N15: =SUM(D15:M15) -> 52
A16: 38029 | B16: 8 | C16: Nordstrøm,S. | D16: 8 | E16: 7 | F16: 7 | G16: 6 | H16: 6 | I16: 6 | J16: 5 | K16: 4 | L16: 3 | N16: =SUM(D16:M16) -> 52
A17: 38057 | B17: 9 | C17: Sangen, K | D17: 10 | E17: 7 | F17: 6 | G17: 6 | H17: 5 | I17: 4 | N17: =SUM(D17:M17) -> 38
A18: 38071 | B18: 10 | C18: Feragen, E | D18: 9 | E18: 7 | F18: 7 | G18: 6 | H18: 4 | I18: 3 | J18: 1 | N18: =SUM(D18:M18) -> 37
A19: 38106 | B19: 11 | C19: Kristiansen,O.J | D19: 15 | E19: 10 | F19: 9 | N19: =SUM(D19:M19) -> 34
A20: 38239 | B20: 12 | C20: Nygård,P.J. | D20: 12 | E20: 4 | F20: 4 | G20: 3 | H20: 2 | I20: 2 | J20: 1 | K20: 0 | N20: =SUM(D20:M20) -> 28
A21: 38253 | B21: 13 | C21: Pilø, L | D21: 15 | E21: 12 | N21: =SUM(D21:M21) -> 27
A22: 38274 | B22: 14 | C22: Solbakken,J.B. | D22: 9 | E22: 8 | F22: 5 | G22: 5 | N22: =SUM(D22:M22) -> 27
A23: 38288 | B23: 15 | C23: Moen, L M | D23: 12 | E23: 9 | F23: 1 | N23: =SUM(D23:M23) -> 22
A24: 38316 | B24: 16 | C24: Storli,F. | D24: 9 | E24: 5 | F24: 5 | G24: 1 | N24: =SUM(D24:M24) -> 20
B25: 17 | C25: Bjerke, J.A. | D25: 7 | E25: 3 | F25: 2 | G25: 0 | N25: =SUM(D25:M25) -> 12
B26: 18 | C26: Ormåsen, H | D26: 9 | N26: =SUM(D26:M26) -> 9
B27: 19 | C27: Kristiansen,R. | D27: 6 | E27: 3 | N27: =SUM(D27:M27) -> 9
B28: 20 | C28: Aarefjord, C | D28: 8 | N28: =SUM(D28:M28) -> 8
B29: 21 | C29: Markovic, D | D29: 6 | E29: 2 | F29: 0 | N29: =SUM(D29:M29) -> 8
B30: 22 | C30: Juliussen, Frank | D30: 4 | E30: 2 | F30: 1 | N30: =SUM(D30:M30) -> 7
B31: 23 | C31: J.Pedersen | D31: 4 | E31: 2 | N31: =SUM(D31:M31) -> 6
B32: 24 | C32: Stenvaag,P.C. | D32: 4 | N32: =SUM(D32:M32) -> 4
B33: 25 | C33: Myrene, J.K. | D33: 3 | N33: =SUM(D33:M33) -> 3
B34: 26 | C34: Rydningen, A | D34: 2 | N34: =SUM(D34:M34) -> 2
B35: 27 | C35: Bakken, A. | D35: 1 | N35: =SUM(D35:M35) -> 1
B36: 28 | C36: Benjaminsen,T. | D36: 0 | N36: =SUM(D36:M36) -> 0
C37: Lundsbakken, J | D37: 0 | N37: =SUM(D37:M37) -> 0
E39: Gruppe under 1750
B41: Nr. | C41: Navn | D41: 1 | E41: 2 | F41: 3 | G41: 4 | H41: 5 | I41: 6 | J41: 7 | K41: 8 | L41: 9 | M41: 10 | N41: SUM
B42: 1 | C42: Jotun,J. | D42: 15 | E42: 15 | F42: 15 | G42: 12 | H42: 12 | I42: 12 | J42: 10 | K42: 10 | L42: 10 | M42: 6 | N42: =SUM(D42:M42) -> 117
B43: 2 | C43: Nordstrøm,S. | D43: 15 | E43: 10 | F43: 10 | G43: 10 | H43: 9 | I43: 9 | J43: 8 | K43: 7 | L43: 6 | N43: =SUM(D43:M43) -> 84
B44: 3 | C44: Nerland, T | D44: 15 | E44: 15 | F44: 15 | G44: 10 | H44: 9 | I44: 8 | J44: 7 | N44: =SUM(D44:M44) -> 79
B45: 4 | C45: Sangen, K | D45: 15 | E45: 12 | F45: 10 | G45: 9 | H45: 9 | I45: 9 | N45: =SUM(D45:M45) -> 64
B46: 5 | C46: Feragen, E | D46: 12 | E46: 12 | F46: 9 | G46: 9 | H46: 7 | I46: 6 | J46: 4 | N46: =SUM(D46:M46) -> 59
B47: 6 | C47: Nygård,P.J. | D47: 15 | E47: 9 | F47: 8 | G47: 6 | H47: 6 | I47: 5 | J47: 5 | K47: 4 | N47: =SUM(D47:M47) -> 58
B48: 7 | C48: Solbakken, J B | D48: 10 | E48: 9 | F48: 8 | G48: 8 | N48: =SUM(D48:M48) -> 35
B49: 8 | C49: Bjerke, J.A. | D49: 12 | E49: 8 | F49: 6 | G49: 5 | N49: =SUM(D49:M49) -> 31
B50: 9 | C50: Storli, F | D50: 10 | E50: 8 | F50: 8 | G50: 4 | N50: =SUM(D50:M50) -> 30
B51: 10 | C51: Moen, L M | D51: 12 | E51: 12 | F51: 5 | N51: =SUM(D51:M51) -> 29
B52: 11 | C52: Juliussen, Frank | D52: 7 | E52: 7 | F52: 4 | N52: =SUM(D52:M52) -> 18
B53: 12 | C53: Ormåsen, H | D53: 15 | N53: =SUM(D53:M53) -> 15
B54: 13 | C54: Kristiansen, R | D54: 8 | E54: 6 | N54: =SUM(D54:M54) -> 14
B55: 14 | C55: Markovic, D | D55: 8 | E55: 5 | F55: 1 | N55: =SUM(D55:M55) -> 14
B56: 15 | C56: Aarefjord, C | D56: 12 | N56: =SUM(D56:M56) -> 12
B57: 16 | C57: Pedersen, J | D57: 7 | E57: 5 | N57: =SUM(D57:M57) -> 12
B58: 17 | C58: Stenvaag, P-C. | D58: 7 | N58: =SUM(D58:M58) -> 7
B59: 18 | C59: Bakken, A. | D59: 7 | N59: =SUM(D59:M59) -> 7
B60: 19 | C60: Rydningen, A | D60: 5 | N60: =SUM(D60:M60) -> 5
B61: 20 | C61: Benjaminsen,T. | D61: 3 | N61: =SUM(D61:M61) -> 3
B62: 21 | C62: Lundsbakken, J | D62: 2 | N62: =SUM(D62:M62) -> 2
E64: Gruppe under 1500
B66: Nr. | C66: Navn | D66: 1 | E66: 2 | F66: 3 | G66: 4 | H66: 5 | I66: 6 | J66: 7 | K66: 8 | L66: 9 | M66: 10 | N66: SUM
B67: 1 | C67: Nordstrøm,S. | D67: 15 | E67: 15 | F67: 12 | G67: 12 | H67: 12 | I67: 12 | J67: 12 | K67: 10 | L67: 9 | N67: =SUM(D67:M67) -> 109
B68: 2 | C68: Feragen, E | D68: 15 | E68: 12 | F68: 12 | G68: 12 | H68: 10 | I68: 10 | J68: 7 | N68: =SUM(D68:M68) -> 78
B69: 3 | C69: Sangen, K | D69: 15 | E69: 15 | F69: 15 | G69: 12 | H69: 10 | I69: 10 | N69: =SUM(D69:M69) -> 77
B70: 4 | C70: Nygård,P.J. | D70: 15 | E70: 10 | F70: 9 | G70: 9 | H70: 8 | I70: 8 | J70: 8 | K70: 8 | N70: =SUM(D70:M70) -> 75
B71: 5 | C71: Moen, L M | D71: 15 | E71: 15 | F71: 9 | N71: =SUM(D71:M71) -> 39
B72: 6 | C72: Bjerke, J.A. | D72: 12 | E72: 9 | F72: 8 | G72: 7 | N72: =SUM(D72:M72) -> 36
B73: 7 | C73: Juliussen, Frank | D73: 9 | E73: 9 | F73: 7 | N73: =SUM(D73:M73) -> 25
B74: 8 | C74: Markovic, D | D74: 10 | E74: 7 | F74: 6 | N74: =SUM(D74:M74) -> 23
B75: 9 | C75: Pedersen, J | D75: 10 | E75: 10 | N75: =SUM(D75:M75) -> 20
B76: 10 | C76: Kristiansen, R | D76: 10 | E76: 9 | N76: =SUM(D76:M76) -> 19
B77: 11 | C77: Ormåsen, H | D77: 15 | N77: =SUM(D77:M77) -> 15
B78: 12 | C78: Rydningen, A | D78: 8 | N78: =SUM(D78:M78) -> 8
C79: Bakken, A. | D79: 8 | N79: =SUM(D79:M79) -> 8
B80: 14 | C80: Lundsbakken, J | D80: 7 | N80: =SUM(D80:M80) -> 7
E82: Gruppe under 1250
B84: Nr. | C84: Navn | D84: 1 | E84: 2 | F84: 3 | G84: 4 | H84: 5 | I84: 6 | J84: 7 | K84: 8 | L84: 9 | M84: 10 | N84: SUM
B85: 1 | C85: Sangen, K | D85: 15 | E85: 15 | F85: 15 | G85: 15 | H85: 15 | I85: 12 | N85: =SUM(D85:M85) -> 87
B86: 2 | C86: Moen, L M | D86: 15 | E86: 15 | F86: 12 | N86: =SUM(D86:M86) -> 42
B87: 3 | C87: Markovic, D | D87: 15 | E87: 12 | F87: 9 | N87: =SUM(D87:M87) -> 36
B88: 4 | C88: Pedersen, J | D88: 15 | E88: 12 | N88: =SUM(D88:M88) -> 27
B89: 5 | C89: Ormåsen, H | D89: 15 | N89: =SUM(D89:M89) -> 15
B90: 6 | C90: Rydningen, A | D90: 12 | N90: =SUM(D90:M90) -> 12
C91: Bakken A. | D91: 12 | N91: =SUM(D91:M91) -> 12
B92: 8 | C92: Lundsbakken, J | D92: 10 | N92: =SUM(D92:M92) -> 10
E94: Gruppe under 1000
B96: Nr. | C96: Navn | D96: 1 | E96: 2 | F96: 3 | G96: 4 | H96: 5 | I96: 6 | J96: 7 | K96: 8 | L96: 9 | M96: 10 | N96: SUM
B97: 1 | C97: Markovic, D | D97: 15 | E97: 15 | F97: 12 | N97: =SUM(D97:M97) -> 42
B98: 2 | C98: Pedersen, J | D98: 15 | E98: 15 | N98: =SUM(D98:M98) -> 30
B99: 3 | C99: Ormåsen, H | D99: 15 | N99: =SUM(D99:M99) -> 15
C100: Bakken, A | D100: 15 | N100: =SUM(D100:M100) -> 15
C101: Lundsbakken, J | D101: 15 | N101: =SUM(D101:M101) -> 15
B102: 6 | C102: Rydningen, A | D102: 12 | N102: =SUM(D102:M102) -> 12