B2: KLUBBMESTERSKAP HURTIGSJAKK 2010
B3: 6 beste turneringer av 8 teller
B5: Sluttresultat
B8: Nr. | C8: Navn | D8: Kl. | E8: 1 | F8: 2 | G8: 3 | H8: 4 | I8: 5 | J8: 6 | K8: Poeng
B9: 1 | C9: Trym Daniel Rødvik | D9: 2 | E9: 15 | F9: 12 | G9: 10 | H9: 10 | I9: 9 | K9: =SUM(E9:J9) -> 56
B10: 2 | C10: Steinar Ormåsen | D10: 2 | E10: 15 | F10: 12 | G10: 12 | H10: 12 | K10: =SUM(E10:J10) -> 51
A11: Hovedside turneringer | B11: 3 | C11: Sigurd Kittilsen | D11: 3 | E11: 10 | F11: 8 | G11: 8 | H11: 8 | K11: =SUM(E11:J11) -> 34
B12: 4 | C12: Geir Brobakken | D12: 2 | E12: 15 | F12: 15 | K12: =SUM(E12:J12) -> 30
B13: 5 | C13: Sindre Brobakken | D13: 4 | E13: 12 | F13: 7 | G13: 7 | K13: =SUM(E13:J13) -> 26
A14: 40248 | B14: 6 | C14: Anders Søberg | D14: 5 | E14: 9 | F14: 7 | G14: 4 | H14: 0 | K14: =SUM(E14:J14) -> 20
A15: 40451 | B15: 7 | C15: Petter Skjerve | D15: 5 | E15: 9 | F15: 9 | K15: =SUM(E15:J15) -> 18
A16: 40465 | B16: 8 | C16: Trym Woldstad | D16: 3 | E16: 10 | F16: 6 | G16: 1 | K16: =SUM(E16:J16) -> 17
A17: 40493 | B17: 9 | C17: Sondre Stai | D17: 5 | E17: 7 | F17: 5 | G17: 5 | K17: =SUM(E17:J17) -> 17
A18: 40524 | B18: 10 | C18: Nikolai Hoff | D18: 1 | E18: 15 | K18: =SUM(E18:J18) -> 15
B19: 11 | C19: Leander Eriksen | D19: 5 | E19: 7 | F19: 4 | G19: 2 | K19: =SUM(E19:J19) -> 13
B20: 12 | C20: Jørgen Brobakken | D20: 5 | E20: 6 | F20: 6 | K20: =SUM(E20:J20) -> 12
B21: 13 | C21: Frode Kaveldiget | D21: 2 | E21: 10 | K21: =SUM(E21:J21) -> 10
B22: 14 | C22: Markus Slettmoen | D22: 5 | E22: 8 | F22: 2 | K22: =SUM(E22:J22) -> 10
B23: 15 | C23: Ole-Jakob Kristiansen | D23: 1 | E23: 9 | K23: =SUM(E23:J23) -> 9
B24: 16 | C24: Stein Nordstrøm | D24: 3 | E24: 6 | F24: 3 | K24: =SUM(E24:J24) -> 9
B25: 17 | C25: Alise Haukenes | D25: 3 | E25: 8 | K25: =SUM(E25:J25) -> 8
B26: 18 | C26: Vemund Skjerve | D26: 5 | E26: 5 | F26: 0 | K26: =SUM(E26:J26) -> 5
B27: 19 | C27: Tommy Eriksen | D27: 5 | E27: 5 | K27: =SUM(E27:J27) -> 5
B28: 20 | C28: Jonas Haukenes | D28: 5 | E28: 4 | K28: =SUM(E28:J28) -> 4
B29: 21 | C29: Ole Borgen | D29: 5 | E29: 4 | K29: =SUM(E29:J29) -> 4
B30: 22 | C30: Elias Haukenes | D30: 5 | E30: 3 | K30: =SUM(E30:J30) -> 3
B31: 22 | C31: Elisabeth Borgen | D31: 5 | E31: 3 | K31: =SUM(E31:J31) -> 3
B32: 24 | C32: Vebjørn Olstad | D32: 5 | E32: 1 | K32: =SUM(E32:J32) -> 1
B34: Gruppe inntil 1750
B36: Nr. | C36: Navn | D36: Kl. | E36: 1 | F36: 2 | G36: 3 | H36: 4 | I36: 5 | J36: 6 | K36: Poeng
B37: 1 | C37: Trym Daniel Rødvik | D37: 2 | E37: 15 | F37: 12 | G37: 12 | H37: 10 | I37: 9 | K37: =SUM(E37:J37) -> 58
B38: 2 | C38: Steinar Ormåsen | D38: 2 | E38: 15 | F38: 15 | G38: 12 | H38: 12 | K38: =SUM(E38:J38) -> 54
B39: 3 | C39: Sigurd Kittilsen | D39: 3 | E39: 10 | F39: 8 | G39: 8 | H39: 8 | K39: =SUM(E39:J39) -> 34
B40: 4 | C40: Geir Brobakken | D40: 2 | E40: 15 | F40: 15 | K40: =SUM(E40:J40) -> 30
B41: 5 | C41: Sindre Brobakken | D41: 4 | E41: 12 | F41: 9 | G41: 7 | K41: =SUM(E41:J41) -> 28
B42: 6 | C42: Anders Søberg | D42: 5 | E42: 9 | F42: 7 | G42: 4 | H42: 0 | K42: =SUM(E42:J42) -> 20
B43: 7 | C43: Petter Skjerve | D43: 5 | E43: 9 | F43: 9 | K43: =SUM(E43:J43) -> 18
B44: 8 | C44: Trym Woldstad | D44: 3 | E44: 10 | F44: 6 | G44: 1 | K44: =SUM(E44:J44) -> 17
B45: 9 | C45: Sondre Stai | D45: 5 | E45: 7 | F45: 5 | G45: 5 | K45: =SUM(E45:J45) -> 17
B46: 10 | C46: Leander Eriksen | D46: 5 | E46: 7 | F46: 4 | G46: 2 | K46: =SUM(E46:J46) -> 13
B47: 11 | C47: Jørgen Brobakken | D47: 5 | E47: 6 | F47: 6 | K47: =SUM(E47:J47) -> 12
B48: 12 | C48: Stein Nordstrøm | D48: 3 | E48: 8 | F48: 3 | K48: =SUM(E48:J48) -> 11
B49: 13 | C49: Alise Haukenes | D49: 3 | E49: 10 | K49: =SUM(E49:J49) -> 10
B50: 13 | C50: Frode Kaveldiget | D50: 2 | E50: 10 | K50: =SUM(E50:J50) -> 10
B51: 15 | C51: Markus Slettmoen | D51: 5 | E51: 8 | F51: 2 | K51: =SUM(E51:J51) -> 10
B52: 16 | C52: Tommy Eriksen | D52: 5 | E52: 7 | K52: =SUM(E52:J52) -> 7
B53: 17 | C53: Ole Borgen | D53: 5 | E53: 6 | K53: =SUM(E53:J53) -> 6
B54: 18 | C54: Vemund Skjerve | D54: 5 | E54: 5 | F54: 0 | K54: =SUM(E54:J54) -> 5
B55: 19 | C55: Elisabeth Borgen | D55: 5 | E55: 5 | K55: =SUM(E55:J55) -> 5
B56: 20 | C56: Jonas Haukenes | D56: 5 | E56: 4 | K56: =SUM(E56:J56) -> 4
B57: 21 | C57: Elias Haukenes | D57: 5 | E57: 3 | K57: =SUM(E57:J57) -> 3
B58: 22 | C58: Vebjørn Olstad | D58: 5 | E58: 1 | K58: =SUM(E58:J58) -> 1
B60: Gruppe inntil 1500
B62: Nr. | C62: Navn | D62: Kl. | E62: 1 | F62: 2 | G62: 3 | H62: 4 | I62: 5 | J62: 6 | K62: Poeng
B63: 1 | C63: Sigurd Kittilsen | D63: 3 | E63: 15 | F63: 12 | G63: 12 | H63: 10 | K63: =SUM(E63:J63) -> 49
B64: 2 | C64: Sindre Brobakken | D64: 4 | E64: 15 | F64: 12 | G64: 9 | K64: =SUM(E64:J64) -> 36
B65: 3 | C65: Anders Søberg | D65: 5 | E65: 12 | F65: 10 | G65: 6 | H65: 3 | K65: =SUM(E65:J65) -> 31
B66: 4 | C66: Trym Woldstad | D66: 3 | E66: 15 | F66: 9 | G66: 4 | K66: =SUM(E66:J66) -> 28
B67: 5 | C67: Petter Skjerve | D67: 5 | E67: 15 | F67: 12 | K67: =SUM(E67:J67) -> 27
B68: 6 | C68: Sondre Stai | D68: 5 | E68: 10 | F68: 8 | G68: 7 | K68: =SUM(E68:J68) -> 25
B69: 7 | C69: Markus Slettmoen | D69: 5 | E69: 10 | F69: 8 | G69: 5 | K69: =SUM(E69:J69) -> 23
B70: 8 | C70: Leander Eriksen | D70: 5 | E70: 9 | F70: 7 | G70: 4 | K70: =SUM(E70:J70) -> 20
B71: 9 | C71: Jørgen Brobakken | D71: 5 | E71: 9 | F71: 8 | K71: =SUM(E71:J71) -> 17
B72: 10 | C72: Alise Haukenes | D72: 3 | E72: 15 | K72: =SUM(E72:J72) -> 15
B73: 11 | C73: Stein Nordstrøm | D73: 3 | E73: 10 | F73: 5 | K73: =SUM(E73:J73) -> 15
B74: 12 | C74: Vemund Skjerve | D74: 5 | E74: 8 | F74: 2 | K74: =SUM(E74:J74) -> 10
B75: 13 | C75: Tommy Eriksen | D75: 5 | E75: 9 | K75: =SUM(E75:J75) -> 9
B76: 14 | C76: Ole Borgen | D76: 5 | E76: 8 | K76: =SUM(E76:J76) -> 8
B77: 15 | C77: Jonas Haukenes | D77: 5 | E77: 7 | K77: =SUM(E77:J77) -> 7
B78: 15 | C78: Elisabeth Borgen | D78: 5 | E78: 7 | K78: =SUM(E78:J78) -> 7
B79: 17 | C79: Elias Haukenes | D79: 5 | E79: 6 | K79: =SUM(E79:J79) -> 6
B80: 18 | C80: Vebjørn Olstad | D80: 5 | E80: 3 | K80: =SUM(E80:J80) -> 3
B82: Gruppe inntil 1250
B84: Nr. | C84: Navn | D84: Kl. | E84: 1 | F84: 2 | G84: 3 | H84: 4 | I84: 5 | J84: 6 | K84: Poeng
B85: 1 | C85: Sindre Brobakken | D85: 4 | E85: 15 | F85: 15 | G85: 12 | K85: =SUM(E85:J85) -> 42
B86: 2 | C86: Anders Søberg | D86: 5 | E86: 15 | F86: 12 | G86: 8 | H86: 5 | K86: =SUM(E86:J86) -> 40
B87: 3 | C87: Sondre Stai | D87: 5 | E87: 12 | F87: 10 | G87: 9 | K87: =SUM(E87:J87) -> 31
B88: 4 | C88: Petter Skjerve | D88: 5 | E88: 15 | F88: 15 | K88: =SUM(E88:J88) -> 30
B89: 5 | C89: Leander Eriksen | D89: 5 | E89: 10 | F89: 9 | G89: 7 | K89: =SUM(E89:J89) -> 26
B90: 6 | C90: Jørgen Brobakken | D90: 5 | E90: 10 | F90: 10 | K90: =SUM(E90:J90) -> 20
B91: 7 | C91: Markus Slettmoen | D91: 5 | E91: 12 | F91: 6 | K91: =SUM(E91:J91) -> 18
B92: 8 | C92: Vemund Skjerve | D92: 5 | E92: 9 | F92: 5 | K92: =SUM(E92:J92) -> 14
B93: 9 | C93: Tommy Eriksen | D93: 5 | E93: 12 | K93: =SUM(E93:J93) -> 12
B94: 10 | C94: Ole Borgen | D94: 5 | E94: 10 | K94: =SUM(E94:J94) -> 10
B95: 11 | C95: Elisabeth Borgen | D95: 5 | E95: 9 | K95: =SUM(E95:J95) -> 9
B96: 12 | C96: Jonas Haukenes | D96: 5 | E96: 8 | K96: =SUM(E96:J96) -> 8
B97: 13 | C97: Elias Haukenes | D97: 5 | E97: 7 | K97: =SUM(E97:J97) -> 7
B98: 14 | C98: Vebjørn Olstad | D98: 5 | E98: 6 | K98: =SUM(E98:J98) -> 6
B100: Gruppe inntil 1000
B102: Nr. | C102: Navn | D102: Kl. | E102: 1 | F102: 2 | G102: 3 | H102: 4 | I102: 5 | J102: 6 | K102: Poeng
B103: 1 | C103: Anders Søberg | D103: 5 | E103: 15 | F103: 15 | G103: 9 | H103: 5 | K103: =SUM(E103:J103) -> 44
B104: 2 | C104: Sondre Stai | D104: 5 | E104: 12 | F104: 12 | G104: 10 | K104: =SUM(E104:J104) -> 34
B105: 3 | C105: Petter Skjerve | D105: 5 | E105: 15 | F105: 15 | K105: =SUM(E105:J105) -> 30
B106: 4 | C106: Leander Eriksen | D106: 5 | E106: 10 | F106: 10 | G106: 8 | K106: =SUM(E106:J106) -> 28
B107: 5 | C107: Jørgen Brobakken | D107: 5 | E107: 12 | F107: 10 | K107: =SUM(E107:J107) -> 22
B108: 6 | C108: Markus Slettmoen | D108: 5 | E108: 12 | F108: 6 | K108: =SUM(E108:J108) -> 18
B109: 7 | C109: Tommy Eriksen | D109: 5 | E109: 15 | K109: =SUM(E109:J109) -> 15
B110: 8 | C110: Vemund Skjerve | D110: 5 | E110: 9 | F110: 6 | K110: =SUM(E110:J110) -> 15
B111: 9 | C111: Ole Borgen | D111: 5 | E111: 12 | K111: =SUM(E111:J111) -> 12
B112: 10 | C112: Elisabeth Borgen | D112: 5 | E112: 10 | K112: =SUM(E112:J112) -> 10
B113: 11 | C113: Jonas Haukenes | D113: 5 | E113: 8 | K113: =SUM(E113:J113) -> 8
B114: 12 | C114: Elias Haukenes | D114: 5 | E114: 7 | K114: =SUM(E114:J114) -> 7
B115: 12 | C115: Vebjørn Olstad | D115: 5 | E115: 7 | K115: =SUM(E115:J115) -> 7