B2: KLUBBMESTERSKAP HURTIGSJAKK 2011
B3: 6 beste turneringer av 8 teller
B5: Sluttresultat
B8: Nr. | C8: Navn | D8: Kl. | E8: 1 | F8: 2 | G8: 3 | H8: 4 | I8: 5 | J8: 6 | K8: Poeng
B9: 1 | C9: Ragnar Holm | D9: 1 | E9: 15 | F9: 15 | G9: 12 | H9: 10 | I9: 9 | K9: =SUM(E9:J9) -> 61
B10: 2 | C10: Geir Brobakken | D10: 2 | E10: 12 | F10: 12 | G10: 10 | H10: 9 | I10: 9 | J10: 8 | K10: =SUM(E10:J10) -> 60
B11: 3 | C11: Jan Jotun | D11: 2 | E11: 15 | F11: 10 | G11: 10 | H11: 8 | I11: 6 | J11: 5 | K11: =SUM(E11:J11) -> 54
A12: Hovedside turneringer | B12: 4 | C12: Lars Pilø | D12: 1 | E12: 15 | F12: 12 | G12: 12 | H12: 10 | K12: =SUM(E12:J12) -> 49
B13: 5 | C13: Stein Nordstrøm | D13: 3 | E13: 9 | F13: 8 | G13: 8 | H13: 8 | I13: 7 | J13: 7 | K13: =SUM(E13:J13) -> 47
B14: 6 | C14: Trym Daniel Rødvik | D14: 2 | E14: 15 | F14: 12 | G14: 10 | H14: 9 | K14: =SUM(E14:J14) -> 46
A15: Resultat 13/1-11 | B15: 7 | C15: Kristian Holm | D15: 1 | E15: 15 | F15: 15 | G15: 15 | K15: =SUM(E15:J15) -> 45
A16: Resultat 10/2-11 | B16: 8 | C16: Steinar Ormåsen | D16: 2 | E16: 12 | F16: 9 | G16: 9 | H16: 7 | I16: 7 | K16: =SUM(E16:J16) -> 44
A17: Resultat 10/3-11 | B17: 9 | C17: Sigurd Kittilsen | D17: 3 | E17: 8 | F17: 7 | G17: 5 | H17: 3 | K17: =SUM(E17:J17) -> 23
A18: Resultat 7/4-11 | B18: 10 | C18: Alise Haukenes | D18: 3 | E18: 9 | F18: 8 | G18: 5 | K18: =SUM(E18:J18) -> 22
A19: Resultat 8/9-11 | B19: 11 | C19: Frode Kaveldiget | D19: 3 | E19: 12 | F19: 6 | G19: 3 | K19: =SUM(E19:J19) -> 21
A20: Resultat 13/10-11 | B20: 12 | C20: Sindre Brobakken | D20: 3 | E20: 10 | F20: 6 | G20: 0 | H20: 0 | K20: =SUM(E20:J20) -> 16
A21: Resultat 10/11-11 | B21: 13 | C21: Tommy Eriksen | D21: 5 | E21: 8 | F21: 7 | G21: 0 | K21: =SUM(E21:J21) -> 15
A22: Resultat 8/12-11 | B22: 14 | C22: Hogne Ormåsen | D22: 4 | E22: 6 | F22: 5 | G22: 4 | K22: =SUM(E22:J22) -> 15
B23: 15 | C23: Petter Skjerve | D23: 4 | E23: 6 | F23: 6 | G23: 2 | H23: 0 | K23: =SUM(E23:J23) -> 14
B24: 16 | C24: Erik Feragen | D24: 3 | E24: 10 | K24: =SUM(E24:J24) -> 10
B25: 17 | C25: Trym Woldstad | D25: 3 | E25: 5 | F25: 4 | G25: 0 | K25: =SUM(E25:J25) -> 9
B26: 18 | C26: Odd Tøstibakken | D26: 5 | E26: 5 | F26: 3 | G26: 1 | H26: 0 | I26: 0 | J26: 0 | K26: =SUM(E26:J26) -> 9
B27: 19 | C27: Jonas Haukenes | D27: 5 | E27: 3 | F27: 3 | G27: 2 | H27: 0 | I27: 0 | J27: 0 | K27: =SUM(E27:J27) -> 8
B28: 20 | C28: Elias Haukenes | D28: 5 | E28: 3 | F28: 2 | G28: 2 | H28: 1 | I28: 0 | J28: 0 | K28: =SUM(E28:J28) -> 8
B29: 21 | C29: Anders Rydningen | D29: 4 | E29: 7 | F29: 0 | K29: =SUM(E29:J29) -> 7
B30: 22 | C30: Jon Kåre Myrene | D30: 1 | E30: 7 | K30: =SUM(E30:J30) -> 7
B31: 23 | C31: Anders Søberg | D31: 5 | E31: 2 | F31: 2 | G31: 1 | H31: 1 | I31: 0 | J31: 0 | K31: =SUM(E31:J31) -> 6
B32: 24 | C32: Sondre Stai | D32: 5 | E32: 2 | F32: 2 | G32: 1 | K32: =SUM(E32:J32) -> 5
B33: 25 | C33: Leander Eriksen | D33: 5 | E33: 4 | F33: 0 | G33: 0 | H33: 0 | I33: 0 | K33: =SUM(E33:J33) -> 4
B34: 26 | C34: Vebjørn Olstad | D34: 5 | E34: 4 | F34: 0 | G34: 0 | K34: =SUM(E34:J34) -> 4
B35: 27 | C35: Erlend Reigstad | D35: 5 | E35: 4 | F35: 0 | K35: =SUM(E35:J35) -> 4
B36: 28 | C36: Jørn Utstøl | D36: 3 | E36: 4 | K36: =SUM(E36:J36) -> 4
B37: 28 | C37: Lars Dalsegg | D37: 4 | E37: 4 | K37: =SUM(E37:J37) -> 4
B38: 30 | C38: Jørgen Brobakken | D38: 5 | E38: 3 | F38: 1 | G38: 0 | H38: 0 | I38: 0 | J38: 0 | K38: =SUM(E38:J38) -> 4
B39: 31 | C39: Stein Sandlie | D39: 3 | E39: 3 | K39: =SUM(E39:J39) -> 3
B40: 32 | C40: Vemund Skjerve | D40: 5 | E40: 1 | F40: 0 | G40: 0 | H40: 0 | K40: =SUM(E40:J40) -> 1
B41: 33 | C41: Tobias Frisvold Ruud | D41: 5 | E41: 1 | F41: 0 | K41: =SUM(E41:J41) -> 1
B42: 34 | C42: Markus Slettmoen | D42: 5 | E42: 0 | F42: 0 | G42: 0 | H42: 0 | I42: 0 | J42: 0 | K42: =SUM(E42:J42) -> 0
B43: 35 | C43: Sivert Ørsleie | D43: 5 | E43: 0 | F43: 0 | G43: 0 | H43: 0 | I43: 0 | K43: =SUM(E43:J43) -> 0
B44: 36 | C44: Elliot S Torp | D44: 5 | E44: 0 | F44: 0 | G44: 0 | K44: =SUM(E44:J44) -> 0
B45: 37 | C45: Ørnulv Bjertnes | D45: 5 | E45: 0 | F45: 0 | K45: =SUM(E45:J45) -> 0
B46: 38 | C46: Odd Frydendal | D46: 2 | E46: 0 | K46: =SUM(E46:J46) -> 0
B47: 38 | C47: Tore Brenne | D47: 4 | E47: 0 | K47: =SUM(E47:J47) -> 0
B48: 38 | C48: Gaute Malmgren | D48: 5 | E48: 0 | K48: =SUM(E48:J48) -> 0
B50: Gruppe inntil 1750
B52: Nr. | C52: Navn | D52: Kl. | E52: 1 | F52: 2 | G52: 3 | H52: 4 | I52: 5 | J52: 6 | K52: Poeng
B53: 1 | C53: Geir Brobakken | D53: 2 | E53: 15 | F53: 15 | G53: 12 | H53: 12 | I53: 12 | J53: 10 | K53: =SUM(E53:J53) -> 76
B54: 2 | C54: Jan Jotun | D54: 2 | E54: 15 | F54: 12 | G54: 12 | H54: 10 | I54: 9 | J54: 8 | K54: =SUM(E54:J54) -> 66
B55: 3 | C55: Steinar Ormåsen | D55: 2 | E55: 15 | F55: 12 | G55: 10 | H55: 10 | I55: 9 | K55: =SUM(E55:J55) -> 56
B56: 4 | C56: Stein Nordstrøm | D56: 3 | E56: 10 | F56: 10 | G56: 9 | H56: 9 | I56: 8 | J56: 8 | K56: =SUM(E56:J56) -> 54
B57: 5 | C57: Trym Daniel Rødvik | D57: 2 | E57: 15 | F57: 15 | G57: 12 | H57: 10 | K57: =SUM(E57:J57) -> 52
B58: 6 | C58: Sindre Brobakken | D58: 3 | E58: 15 | F58: 9 | G58: 7 | H58: 0 | I58: 0 | K58: =SUM(E58:J58) -> 31
B59: 7 | C59: Sigurd Kittilsen | D59: 3 | E59: 9 | F59: 8 | G59: 7 | H59: 6 | K59: =SUM(E59:J59) -> 30
B60: 8 | C60: Frode Kaveldiget | D60: 3 | E60: 15 | F60: 9 | G60: 5 | K60: =SUM(E60:J60) -> 29
B61: 9 | C61: Alise Haukenes | D61: 3 | E61: 10 | F61: 9 | G61: 6 | K61: =SUM(E61:J61) -> 25
B62: 10 | C62: Hogne Ormåsen | D62: 4 | E62: 8 | F62: 7 | G62: 5 | K62: =SUM(E62:J62) -> 20
B63: 11 | C63: Petter Skjerve | D63: 4 | E63: 7 | F63: 6 | G63: 3 | H63: 0 | K63: =SUM(E63:J63) -> 16
B64: 12 | C64: Elias Haukenes | D64: 5 | E64: 4 | F64: 4 | G64: 3 | H64: 3 | I64: 2 | J64: 0 | K64: =SUM(E64:J64) -> 16
B65: 13 | C65: Anders Søberg | D65: 5 | E65: 3 | F65: 3 | G65: 3 | H65: 2 | I65: 2 | J65: 2 | K65: =SUM(E65:J65) -> 15
B66: 14 | C66: Odd Tøstibakken | D66: 5 | E66: 5 | F66: 5 | G66: 4 | H66: 0 | I66: 0 | J66: 0 | K66: =SUM(E66:J66) -> 14
B67: 15 | C67: Sondre Stai | D67: 5 | E67: 6 | F67: 5 | G67: 2 | K67: =SUM(E67:J67) -> 13
B68: 16 | C68: Jonas Haukenes | D68: 5 | E68: 5 | F68: 4 | G68: 4 | H68: 0 | I68: 0 | J68: 0 | K68: =SUM(E68:J68) -> 13
B69: 17 | C69: Erik Feragen | D69: 3 | E69: 12 | K69: =SUM(E69:J69) -> 12
B70: 18 | C70: Trym Woldstad | D70: 3 | E70: 6 | F70: 6 | G70: 0 | K70: =SUM(E70:J70) -> 12
B71: 19 | C71: Jørgen Brobakken | D71: 5 | E71: 4 | F71: 3 | G71: 3 | H71: 1 | I71: 0 | J71: 0 | K71: =SUM(E71:J71) -> 11
B72: 20 | C72: Anders Rydningen | D72: 4 | E72: 8 | F72: 1 | K72: =SUM(E72:J72) -> 9
B73: 21 | C73: Tommy Eriksen | D73: 5 | E73: 7 | F73: 0 | K73: =SUM(E73:J73) -> 7
B74: 21 | C74: Erlend Reigstad | D74: 5 | E74: 7 | F74: 0 | K74: =SUM(E74:J74) -> 7
B75: 23 | C75: Stein Sandlie | D75: 3 | E75: 7 | K75: =SUM(E75:J75) -> 7
B76: 24 | C76: Leander Eriksen | D76: 5 | E76: 4 | F76: 2 | G76: 1 | H76: 0 | I76: 0 | K76: =SUM(E76:J76) -> 7
B77: 25 | C77: Jørn Utstøl | D77: 3 | E77: 6 | K77: =SUM(E77:J77) -> 6
B78: 26 | C78: Vebjørn Olstad | D78: 5 | E78: 5 | F78: 0 | G78: 0 | K78: =SUM(E78:J78) -> 5
B79: 27 | C79: Lars Dalsegg | D79: 4 | E79: 5 | K79: =SUM(E79:J79) -> 5
B80: 28 | C80: Markus Slettmoen | D80: 5 | E80: 4 | F80: 1 | G80: 0 | H80: 0 | I80: 0 | J80: 0 | K80: =SUM(E80:J80) -> 5
B81: 29 | C81: Tobias Frisvold Ruud | D81: 5 | E81: 2 | F81: 0 | K81: =SUM(E81:J81) -> 2
B82: 30 | C82: Vemund Skjerve | D82: 5 | E82: 1 | F82: 1 | G82: 0 | H82: 0 | K82: =SUM(E82:J82) -> 2
B83: 31 | C83: Sivert Ørsleie | D83: 5 | E83: 0 | F83: 0 | G83: 0 | H83: 0 | I83: 0 | K83: =SUM(E83:J83) -> 0
B84: 32 | C84: Elliot S Torp | D84: 5 | E84: 0 | F84: 0 | G84: 0 | K84: =SUM(E84:J84) -> 0
B85: 33 | C85: Odd Frydendal | D85: 2 | E85: 0 | K85: =SUM(E85:J85) -> 0
B86: 33 | C86: Tore Brenne | D86: 4 | E86: 0 | K86: =SUM(E86:J86) -> 0
B87: 33 | C87: Gaute Malmgren | D87: 5 | E87: 0 | K87: =SUM(E87:J87) -> 0
B88: 33 | C88: Ørnulv Bjertnes | D88: 5 | E88: 0 | K88: =SUM(E88:J88) -> 0
B90: Gruppe inntil 1500
B92: Nr. | C92: Navn | D92: Kl. | E92: 1 | F92: 2 | G92: 3 | H92: 4 | I92: 5 | J92: 6 | K92: Poeng
B93: 1 | C93: Stein Nordstrøm | D93: 3 | E93: 15 | F93: 12 | G93: 15 | H93: 12 | I93: 12 | J93: 12 | K93: =SUM(E93:J93) -> 78
B94: 2 | C94: Sigurd Kittilsen | D94: 3 | E94: 12 | F94: 10 | G94: 9 | H94: 9 | K94: =SUM(E94:J94) -> 40
B95: 3 | C95: Alise Haukenes | D95: 3 | E95: 15 | F95: 15 | G95: 9 | K95: =SUM(E95:J95) -> 39
B96: 4 | C96: Frode Kaveldiget | D96: 3 | E96: 15 | F96: 15 | G96: 8 | K96: =SUM(E96:J96) -> 38
B97: 5 | C97: Sindre Brobakken | D97: 3 | E97: 15 | F97: 12 | G97: 9 | H97: 1 | I97: 0 | K97: =SUM(E97:J97) -> 37
B98: 6 | C98: Odd Tøstibakken | D98: 5 | E98: 8 | F98: 8 | G98: 8 | H98: 7 | I98: 1 | J98: 1 | K98: =SUM(E98:J98) -> 33
B99: 7 | C99: Anders Søberg | D99: 5 | E99: 7 | F99: 6 | G99: 5 | H99: 5 | I99: 5 | J99: 4 | K99: =SUM(E99:J99) -> 32
B100: 8 | C100: Hogne Ormåsen | D100: 4 | E100: 10 | F100: 10 | G100: 9 | K100: =SUM(E100:J100) -> 29
B101: 9 | C101: Jonas Haukenes | D101: 5 | E101: 7 | F101: 7 | G101: 7 | H101: 3 | I101: 2 | J101: 2 | K101: =SUM(E101:J101) -> 28
B102: 10 | C102: Petter Skjerve | D102: 4 | E102: 10 | F102: 9 | G102: 5 | H102: 3 | K102: =SUM(E102:J102) -> 27
B103: 11 | C103: Elias Haukenes | D103: 5 | E103: 6 | F103: 6 | G103: 6 | H103: 5 | I103: 3 | J103: 1 | K103: =SUM(E103:J103) -> 27
B104: 12 | C104: Jørgen Brobakken | D104: 5 | E104: 6 | F104: 6 | G104: 6 | H104: 5 | I104: 1 | J104: 0 | K104: =SUM(E104:J104) -> 24
B105: 13 | C105: Sondre Stai | D105: 5 | E105: 9 | F105: 8 | G105: 6 | K105: =SUM(E105:J105) -> 23
B106: 14 | C106: Trym Woldstad | D106: 3 | E106: 8 | F106: 8 | G106: 2 | K106: =SUM(E106:J106) -> 18
B107: 15 | C107: Anders Rydningen | D107: 4 | E107: 12 | F107: 4 | K107: =SUM(E107:J107) -> 16
B108: 16 | C108: Leander Eriksen | D108: 5 | E108: 7 | F108: 4 | G108: 3 | H108: 2 | K108: =SUM(E108:J108) -> 16
B109: 17 | C109: Markus Slettmoen | D109: 5 | E109: 7 | F109: 3 | G109: 2 | H109: 2 | I109: 2 | J109: 0 | K109: =SUM(E109:J109) -> 16
B110: 18 | C110: Erik Feragen | D110: 3 | E110: 15 | K110: =SUM(E110:J110) -> 15
B111: 19 | C111: Tommy Eriksen | D111: 5 | E111: 10 | F111: 2 | K111: =SUM(E111:J111) -> 12
B112: 20 | C112: Vebjørn Olstad | D112: 5 | E112: 7 | F112: 4 | G112: 0 | K112: =SUM(E112:J112) -> 11
B113: 21 | C113: Vemund Skjerve | D113: 5 | E113: 4 | F113: 4 | G113: 3 | H113: 0 | K113: =SUM(E113:J113) -> 11
B114: 22 | C114: Erlend Reigstad | D114: 5 | E114: 10 | F114: 0 | K114: =SUM(E114:J114) -> 10
B115: 23 | C115: Stein Sandlie | D115: 3 | E115: 10 | K115: =SUM(E115:J115) -> 10
B116: 24 | C116: Jørn Utstøl | D116: 3 | E116: 9 | K116: =SUM(E116:J116) -> 9
B117: 25 | C117: Lars Dalsegg | D117: 4 | E117: 8 | K117: =SUM(E117:J117) -> 8
B118: 26 | C118: Tobias Frisvold Ruud | D118: 5 | E118: 5 | F118: 1 | K118: =SUM(E118:J118) -> 6
B119: 27 | C119: Sivert Ørsleie | D119: 5 | E119: 3 | F119: 1 | G119: 0 | H119: 0 | I119: 0 | K119: =SUM(E119:J119) -> 4
B120: 28 | C120: Elliot S Torp | D120: 5 | E120: 0 | F120: 0 | G120: 0 | K120: =SUM(E120:J120) -> 0
B121: 29 | C121: Ørnulv Bjertnes | D121: 5 | E121: 0 | F121: 0 | K121: =SUM(E121:J121) -> 0
B122: 30 | C122: Tore Brenne | D122: 4 | E122: 0 | K122: =SUM(E122:J122) -> 0
B123: 30 | C123: Gaute Malmgren | D123: 5 | E123: 0 | K123: =SUM(E123:J123) -> 0
B125: Gruppe inntil 1250
B127: Nr. | C127: Navn | D127: Kl. | E127: 1 | F127: 2 | G127: 3 | H127: 4 | I127: 5 | J127: 6 | K127: Poeng
B128: 1 | C128: Jonas Haukenes | D128: 5 | E128: 12 | F128: 12 | G128: 12 | H128: 7 | I128: 6 | J128: 4 | K128: =SUM(E128:J128) -> 53
B129: 2 | C129: Elias Haukenes | D129: 5 | E129: 10 | F129: 10 | G129: 10 | H129: 9 | I129: 8 | J129: 6 | K129: =SUM(E129:J129) -> 53
B130: 3 | C130: Anders Søberg | D130: 5 | E130: 9 | F130: 9 | G130: 8 | H130: 9 | I130: 8 | J130: 8 | K130: =SUM(E130:J130) -> 51
B131: 4 | C131: Odd Tøstibakken | D131: 5 | E131: 12 | F131: 10 | G131: 9 | H131: 6 | I131: 5 | J131: 2 | K131: =SUM(E131:J131) -> 44
B132: 5 | C132: Jørgen Brobakken | D132: 5 | E132: 12 | F132: 10 | G132: 9 | H132: 6 | I132: 4 | J132: 3 | K132: =SUM(E132:J132) -> 44
B133: 6 | C133: Petter Skjerve | D133: 4 | E133: 12 | F133: 12 | G133: 10 | H133: 7 | K133: =SUM(E133:J133) -> 41
B134: 7 | C134: Hogne Ormåsen | D134: 4 | E134: 15 | F134: 15 | G134: 10 | K134: =SUM(E134:J134) -> 40
B135: 8 | C135: Markus Slettmoen | D135: 5 | E135: 10 | F135: 8 | G135: 7 | H135: 6 | I135: 5 | J135: 2 | K135: =SUM(E135:J135) -> 38
B136: 9 | C136: Sondre Stai | D136: 5 | E136: 15 | F136: 12 | G136: 7 | K136: =SUM(E136:J136) -> 34
B137: 10 | C137: Leander Eriksen | D137: 5 | E137: 9 | F137: 8 | G137: 7 | H137: 0 | I137: 0 | K137: =SUM(E137:J137) -> 24
B138: 11 | C138: Vebjørn Olstad | D138: 5 | E138: 15 | F138: 5 | G138: 3 | K138: =SUM(E138:J138) -> 23
B139: 12 | C139: Anders Rydningen | D139: 4 | E139: 15 | F139: 7 | K139: =SUM(E139:J139) -> 22
B140: 13 | C140: Tommy Eriksen | D140: 5 | E140: 15 | F140: 6 | K140: =SUM(E140:J140) -> 21
B141: 14 | C141: Vemund Skjerve | D141: 5 | E141: 8 | F141: 6 | G141: 5 | H141: 1 | K141: =SUM(E141:J141) -> 20
B142: 15 | C142: Erlend Reigstad | D142: 5 | E142: 15 | F142: 3 | K142: =SUM(E142:J142) -> 18
B143: 16 | C143: Sivert Ørsleie | D143: 5 | E143: 5 | F143: 5 | G143: 4 | H143: 4 | I143: 0 | K143: =SUM(E143:J143) -> 18
B144: 17 | C144: Lars Dalsegg | D144: 4 | E144: 15 | K144: =SUM(E144:J144) -> 15
B145: 18 | C145: Tobias Frisvold Ruud | D145: 5 | E145: 9 | F145: 5 | K145: =SUM(E145:J145) -> 14
B146: 19 | C146: Elliot S Torp | D146: 5 | E146: 3 | F146: 2 | G146: 0 | K146: =SUM(E146:J146) -> 5
B147: 20 | C147: Ørnulv Bjertnes | D147: 5 | E147: 3 | F147: 1 | K147: =SUM(E147:J147) -> 4
B148: 21 | C148: Tore Brenne | D148: 4 | E148: 0 | K148: =SUM(E148:J148) -> 0
B149: 21 | C149: Gaute Malmgren | D149: 5 | E149: 0 | K149: =SUM(E149:J149) -> 0
B151: Gruppe inntil 1000
B153: Nr. | C153: Navn | D153: Kl. | E153: 1 | F153: 2 | G153: 3 | H153: 4 | I153: 5 | J153: 6 | K153: Poeng
B154: 1 | C154: Jonas Haukenes | D154: 5 | E154: 15 | F154: 15 | G154: 15 | H154: 8 | I154: 6 | J154: 6 | K154: =SUM(E154:J154) -> 65
B155: 2 | C155: Elias Haukenes | D155: 5 | E155: 12 | F155: 12 | G155: 10 | H155: 10 | I155: 9 | J155: 7 | K155: =SUM(E155:J155) -> 60
B156: 3 | C156: Anders Søberg | D156: 5 | E156: 12 | F156: 10 | G156: 10 | H156: 9 | I156: 9 | J156: 8 | K156: =SUM(E156:J156) -> 58
B157: 4 | C157: Odd Tøstibakken | D157: 5 | E157: 15 | F157: 12 | G157: 12 | H157: 7 | I157: 7 | J157: 4 | K157: =SUM(E157:J157) -> 57
B158: 5 | C158: Jørgen Brobakken | D158: 5 | E158: 12 | F158: 12 | G158: 9 | H158: 9 | I158: 6 | J158: 4 | K158: =SUM(E158:J158) -> 52
B159: 6 | C159: Markus Slettmoen | D159: 5 | E159: 10 | F159: 9 | G159: 8 | H159: 8 | I159: 5 | J159: 3 | K159: =SUM(E159:J159) -> 43
B160: 7 | C160: Sondre Stai | D160: 5 | E160: 15 | F160: 12 | G160: 10 | K160: =SUM(E160:J160) -> 37
B161: 8 | C161: Leander Eriksen | D161: 5 | E161: 10 | F161: 9 | G161: 7 | H161: 6 | I161: 4 | K161: =SUM(E161:J161) -> 36
B162: 9 | C162: Vebjørn Olstad | D162: 5 | E162: 15 | F162: 8 | G162: 5 | K162: =SUM(E162:J162) -> 28
B163: 10 | C163: Vemund Skjerve | D163: 5 | E163: 9 | F163: 7 | G163: 6 | H163: 5 | K163: =SUM(E163:J163) -> 27
B164: 11 | C164: Tommy Eriksen | D164: 5 | E164: 15 | F164: 8 | K164: =SUM(E164:J164) -> 23
B165: 12 | C165: Sivert Ørsleie | D165: 5 | E165: 6 | F165: 6 | G165: 5 | H165: 4 | I165: 2 | K165: =SUM(E165:J165) -> 23
B166: 13 | C166: Erlend Reigstad | D166: 5 | E166: 15 | F166: 5 | K166: =SUM(E166:J166) -> 20
B167: 14 | C167: Tobias Frisvold Ruud | D167: 5 | E167: 10 | F167: 7 | K167: =SUM(E167:J167) -> 17
B168: 15 | C168: Elliot S Torp | D168: 5 | E168: 4 | F168: 3 | G168: 2 | K168: =SUM(E168:J168) -> 9
B169: 16 | C169: Ørnulv Bjertnes | D169: 5 | E169: 4 | F169: 3 | K169: =SUM(E169:J169) -> 7
B170: 17 | C170: Gaute Malmgren | D170: 5 | E170: 1 | K170: =SUM(E170:J170) -> 1