B2: KLUBBMESTERSKAP HURTIGSJAKK 2008
B3: 6 beste turneringer av 8 teller
B5: Sluttresultat
B7: Klubbmesterskapet
A9: 2007 | B9: Nr. | C9: Navn | D9: Kl. | E9: 1 | F9: 2 | G9: 3 | H9: 4 | I9: 5 | J9: 6 | K9: Poeng
A10: 2009 | B10: 1 | C10: Ragnar Holm | D10: M | E10: 15 | F10: 15 | G10: 15 | H10: 15 | I10: 15 | J10: 12 | K10: =SUM(E10:J10) -> 87
B11: 2 | C11: Kristian Holm | D11: 3 | E11: 15 | F11: 15 | G11: 12 | H11: 12 | I11: 9 | J11: 9 | K11: =SUM(E11:J11) -> 72
A12: Hovedside turneringer | B12: 3 | C12: Geir Brobakken | D12: 2 | E12: 15 | F12: 10 | G12: 10 | H12: 8 | I12: 7 | J12: 7 | K12: =SUM(E12:J12) -> 57
B13: 4 | C13: Espen Wasshaug | D13: 3 | E13: 12 | F13: 10 | G13: 10 | H13: 9 | I13: 7 | K13: =SUM(E13:J13) -> 48
A14: 39457 | B14: 5 | C14: Stein Nordstrøm | D14: 3 | E14: 12 | F14: 10 | G14: 8 | H14: 8 | I14: 8 | K14: =SUM(E14:J14) -> 46
A15: 39499 | B15: 6 | C15: Trym Daniel Rødvik | D15: 5 | E15: 9 | F15: 6 | G15: 6 | H15: 5.5 | I15: 5 | J15: 3 | K15: =SUM(E15:J15) -> 34.5
A16: 39520 | B16: 7 | C16: Frode Kaveldiget | D16: 2 | E16: 9 | F16: 9 | G16: 6 | H16: 4 | I16: 2 | K16: =SUM(E16:J16) -> 30
A17: 39548 | B17: 8 | C17: Frode Storli | D17: 3 | E17: 12 | F17: 10 | G17: 4 | H17: 2 | K17: =SUM(E17:J17) -> 28
A18: 39702 | B18: 9 | C18: Lars Pilø | D18: 1 | E18: 10 | F18: 8 | G18: 8 | K18: =SUM(E18:J18) -> 26
A19: 39730 | B19: 10 | C19: Sindre Brobakken | D19: 5 | E19: 7 | F19: 7 | G19: 4 | H19: 3 | I19: 2 | J19: 1 | K19: =SUM(E19:J19) -> 24
A20: 39765 | B20: 11 | C20: Steinar Ormåsen | D20: 1 | E20: 12 | F20: 8 | K20: =SUM(E20:J20) -> 20
A21: 39793 | B21: 12 | C21: Erlend Pilø | D21: 4 | E21: 10 | F21: 7 | G21: 3 | K21: =SUM(E21:J21) -> 20
B22: 13 | C22: Tom Allsted | D22: 2 | E22: 7 | F22: 6 | G22: 5 | H22: 2 | K22: =SUM(E22:J22) -> 20
B23: 14 | C23: Trym Woldstad | D23: 5 | E23: 5.5 | F23: 5 | G23: 4 | K23: =SUM(E23:J23) -> 14.5
B24: 15 | C24: Alise Haukenes | D24: 5 | E24: 6 | F24: 4 | G24: 1 | H24: 1 | K24: =SUM(E24:J24) -> 12
B25: 16 | C25: Frank Juliussen | D25: 4 | E25: 6 | F25: 5 | K25: =SUM(E25:J25) -> 11
B26: 17 | C26: Erik Feragen | D26: 3 | E26: 9 | K26: =SUM(E26:J26) -> 9
B27: 18 | C27: Martin Kolloen | D27: 5 | E27: 5 | F27: 2 | G27: 2 | K27: =SUM(E27:J27) -> 9
B28: 19 | C28: Thomas Nilsen | D28: 2 | E28: 8 | K28: =SUM(E28:J28) -> 8
B29: 20 | C29: Reidar Kristiansen | D29: 4 | E29: 4 | F29: 3 | K29: =SUM(E29:J29) -> 7
B30: 21 | C30: Ole Bækken | D30: 3 | E30: 3 | F30: 3 | K30: =SUM(E30:J30) -> 6
B31: 22 | C31: Leif Magne Moen | D31: 5 | E31: 5 | K31: =SUM(E31:J31) -> 5
B32: 23 | C32: Kenneth Zachariassen | D32: 5 | E32: 5 | K32: =SUM(E32:J32) -> 5
B33: 24 | C33: Morgan Henriksen | D33: 3 | E33: 0 | K33: =SUM(E33:J33) -> 0
B35: Gruppe inntil 1750
B37: Nr. | C37: Navn | D37: Kl. | E37: 1 | F37: 2 | G37: 3 | H37: 4 | I37: 5 | J37: 6 | K37: Poeng
B38: 1 | C38: Kristian Holm | D38: 3 | E38: 15 | F38: 15 | G38: 15 | H38: 15 | I38: 15 | J38: 10 | K38: =SUM(E38:J38) -> 85
B39: 2 | C39: Geir Brobakken | D39: 2 | E39: 15 | F39: 12 | G39: 12 | H39: 9 | I39: 9 | J39: 8 | K39: =SUM(E39:J39) -> 65
B40: 3 | C40: Stein Nordstrøm | D40: 3 | E40: 15 | F40: 12 | G40: 10 | H40: 9 | I40: 9 | K40: =SUM(E40:J40) -> 55
B41: 4 | C41: Espen Wasshaug | D41: 3 | E41: 12 | F41: 12 | G41: 12 | H41: 10 | I41: 9 | K41: =SUM(E41:J41) -> 55
B42: 5 | C42: Trym Daniel Rødvik | D42: 5 | E42: 10 | F42: 8 | G42: 8 | H42: 7 | I42: 6 | J42: 5.5 | K42: =SUM(E42:J42) -> 44.5
B43: 6 | C43: Frode Storli | D43: 3 | E43: 15 | F43: 12 | G43: 6 | H43: 5 | K43: =SUM(E43:J43) -> 38
B44: 7 | C44: Frode Kaveldiget | D44: 2 | E44: 10 | F44: 10 | G44: 7 | H44: 6 | I44: 4 | K44: =SUM(E44:J44) -> 37
B45: 8 | C45: Sindre Brobakken | D45: 5 | E45: 8 | F45: 7 | G45: 6 | H45: 4 | I45: 4 | J45: 4 | K45: =SUM(E45:J45) -> 33
B46: 9 | C46: Erlend Pilø | D46: 4 | E46: 12 | F46: 10 | G46: 5 | K46: =SUM(E46:J46) -> 27
B47: 10 | C47: Tom Allsted | D47: 2 | E47: 9 | F47: 8 | G47: 7 | H47: 2 | K47: =SUM(E47:J47) -> 26
B48: 11 | C48: Trym Woldstad | D48: 5 | E48: 7 | F48: 6 | G48: 5.5 | K48: =SUM(E48:J48) -> 18.5
B49: 12 | C49: Alise Haukenes | D49: 5 | E49: 7 | F49: 5 | G49: 3 | H49: 1 | K49: =SUM(E49:J49) -> 16
B50: 13 | C50: Frank Juliussen | D50: 4 | E50: 8 | F50: 7 | K50: =SUM(E50:J50) -> 15
B51: 14 | C51: Martin Kolloen | D51: 5 | E51: 6 | F51: 4 | G51: 3 | K51: =SUM(E51:J51) -> 13
B52: 15 | C52: Thomas Nilsen | D52: 2 | E52: 9 | K52: =SUM(E52:J52) -> 9
B53: 16 | C53: Erik Feragen | D53: 3 | E53: 9 | K53: =SUM(E53:J53) -> 9
B54: 17 | C54: Reidar Kristiansen | D54: 4 | E54: 5 | F54: 4 | K54: =SUM(E54:J54) -> 9
B55: 18 | C55: Ole Bækken | D55: 3 | E55: 5 | F55: 3 | K55: =SUM(E55:J55) -> 8
B56: 19 | C56: Leif Magne Moen | D56: 5 | E56: 7 | K56: =SUM(E56:J56) -> 7
B57: 20 | C57: Kenneth Zachariassen | D57: 5 | E57: 6 | K57: =SUM(E57:J57) -> 6
B58: 21 | C58: Morgan Henriksen | D58: 3 | E58: 2 | K58: =SUM(E58:J58) -> 2
B60: Gruppe inntil 1500
B62: Nr. | C62: Navn | D62: Kl. | E62: 1 | F62: 2 | G62: 3 | H62: 4 | I62: 5 | J62: 6 | K62: Poeng
B63: 1 | C63: Kristian Holm | D63: 3 | E63: 15 | F63: 15 | G63: 15 | H63: 15 | I63: 15 | J63: 10 | K63: =SUM(E63:J63) -> 85
B64: 2 | C64: Stein Nordstrøm | D64: 3 | E64: 15 | F64: 12 | G64: 12 | H64: 10 | I64: 9 | K64: =SUM(E64:J64) -> 58
B65: 3 | C65: Espen Wasshaug | D65: 3 | E65: 12 | F65: 12 | G65: 12 | H65: 12 | I65: 9 | K65: =SUM(E65:J65) -> 57
B66: 4 | C66: Trym Daniel Rødvik | D66: 5 | E66: 12 | F66: 10 | G66: 9 | H66: 8 | I66: 7 | J66: 6.5 | K66: =SUM(E66:J66) -> 52.5
B67: 5 | C67: Sindre Brobakken | D67: 5 | E67: 10 | F67: 9 | G67: 8 | H67: 7 | I67: 6 | J67: 5 | K67: =SUM(E67:J67) -> 45
B68: 6 | C68: Frode Storli | D68: 3 | E68: 15 | F68: 15 | G68: 7 | H68: 6 | K68: =SUM(E68:J68) -> 43
B69: 7 | C69: Erlend Pilø | D69: 4 | E69: 12 | F69: 10 | G69: 8 | K69: =SUM(E69:J69) -> 30
B70: 8 | C70: Alise Haukenes | D70: 5 | E70: 9 | F70: 7 | G70: 6 | H70: 1 | K70: =SUM(E70:J70) -> 23
B71: 9 | C71: Trym Woldstad | D71: 5 | E71: 8 | F71: 8 | G71: 6.5 | K71: =SUM(E71:J71) -> 22.5
B72: 10 | C72: Martin Kolloen | D72: 5 | E72: 8 | F72: 7 | G72: 5 | K72: =SUM(E72:J72) -> 20
B73: 11 | C73: Frank Juliussen | D73: 4 | E73: 9 | F73: 9 | K73: =SUM(E73:J73) -> 18
B74: 12 | C74: Reidar Kristiansen | D74: 4 | E74: 8 | F74: 4 | K74: =SUM(E74:J74) -> 12
B75: 13 | C75: Leif Magne Moen | D75: 5 | E75: 10 | K75: =SUM(E75:J75) -> 10
B76: 14 | C76: Erik Feragen | D76: 3 | E76: 9 | K76: =SUM(E76:J76) -> 9
B77: 15 | C77: Ole Bækken | D77: 3 | E77: 6 | F77: 3 | K77: =SUM(E77:J77) -> 9
B78: 16 | C78: Kenneth Zachariassen | D78: 5 | E78: 8 | K78: =SUM(E78:J78) -> 8
B79: 17 | C79: Morgan Henriksen | D79: 3 | E79: 4 | K79: =SUM(E79:J79) -> 4
B81: Gruppe inntil 1250
B83: Nr. | C83: Navn | D83: Kl. | E83: 1 | F83: 2 | G83: 3 | H83: 4 | I83: 5 | J83: 6 | K83: Poeng
B84: 1 | C84: Trym Daniel Rødvik | D84: 5 | E84: 15 | F84: 15 | G84: 15 | H84: 12 | I84: 11 | J84: 9 | K84: =SUM(E84:J84) -> 77
B85: 2 | C85: Sindre Brobakken | D85: 5 | E85: 15 | F85: 15 | G85: 10 | H85: 10 | I85: 10 | J85: 9 | K85: =SUM(E85:J85) -> 69
B86: 3 | C86: Erlend Pilø | D86: 4 | E86: 15 | F86: 15 | G86: 9 | K86: =SUM(E86:J86) -> 39
B87: 4 | C87: Alise Haukenes | D87: 5 | E87: 12 | F87: 10 | G87: 8 | H87: 8 | K87: =SUM(E87:J87) -> 38
B88: 5 | C88: Trym Woldstad | D88: 5 | E88: 12 | F88: 11 | G88: 10 | K88: =SUM(E88:J88) -> 33
B89: 6 | C89: Frank Juliussen | D89: 4 | E89: 15 | F89: 12 | K89: =SUM(E89:J89) -> 27
B90: 7 | C90: Martin Kolloen | D90: 5 | E90: 10 | F90: 8 | G90: 8 | K90: =SUM(E90:J90) -> 26
B91: 8 | C91: Reidar Kristiansen | D91: 4 | E91: 12 | F91: 9 | K91: =SUM(E91:J91) -> 21
B92: 9 | C92: Leif Magne Moen | D92: 5 | E92: 12 | K92: =SUM(E92:J92) -> 12
B93: 10 | C93: Kenneth Zachariassen | D93: 5 | E93: 12 | K93: =SUM(E93:J93) -> 12
B95: Gruppe inntil 1000
B97: Nr. | C97: Navn | D97: Kl. | E97: 1 | F97: 2 | G97: 3 | H97: 4 | I97: 5 | J97: 6 | K97: Poeng
B98: 1 | C98: Trym Daniel Rødvik | D98: 5 | E98: 15 | F98: 15 | G98: 15 | H98: 15 | I98: 12 | J98: 11 | K98: =SUM(E98:J98) -> 83
B99: 2 | C99: Sindre Brobakken | D99: 5 | E99: 15 | F99: 15 | G99: 12 | H99: 12 | I99: 10 | J99: 10 | K99: =SUM(E99:J99) -> 74
B100: 3 | C100: Alise Haukenes | D100: 5 | E100: 12 | F100: 10 | G100: 9 | H100: 9 | K100: =SUM(E100:J100) -> 40
B101: 4 | C101: Trym Woldstad | D101: 5 | E101: 15 | F101: 12 | G101: 11 | K101: =SUM(E101:J101) -> 38
B102: 5 | C102: Martin Kolloen | D102: 5 | E102: 10 | F102: 9 | G102: 8 | K102: =SUM(E102:J102) -> 27
B103: 6 | C103: Kenneth Zachariassen | D103: 5 | E103: 15 | K103: =SUM(E103:J103) -> 15
B104: 7 | C104: Leif Magne Moen | D104: 5 | E104: 12 | K104: =SUM(E104:J104) -> 12