B2: KLUBBMESTERSKAP HURTIGSJAKK 2009
B3: 6 beste turneringer av 8 teller
B5: Sluttresultat
B8: Nr. | C8: Navn | D8: Kl. | E8: 1 | F8: 2 | G8: 3 | H8: 4 | I8: 5 | J8: 6 | K8: Poeng
B9: 1 | C9: Kristian Holm | D9: 2 | E9: 15 | F9: 15 | G9: 15 | H9: 12 | I9: 12 | J9: 9 | K9: =SUM(E9:J9) -> 78
B10: 2 | C10: Geir Brobakken | D10: 2 | E10: 15 | F10: 12 | G10: 9 | H10: 9 | I10: 6 | K10: =SUM(E10:J10) -> 51
A11: Hovedside turneringer | B11: 3 | C11: Nikolai Hoff | D11: M | E11: 15 | F11: 12 | G11: 12 | H11: 10 | K11: =SUM(E11:J11) -> 49
B12: 4 | C12: Trym Daniel Rødvik | D12: 4 | E12: 15 | F12: 12 | G12: 9 | H12: 4 | I12: 0 | K12: =SUM(E12:J12) -> 40
B13: 5 | C13: Ragnar Holm | D13: M | E13: 12 | F13: 10 | G13: 8 | H13: 6 | K13: =SUM(E13:J13) -> 36
A14: 39828 | B14: 6 | C14: Lars Pilø | D14: 1 | E14: 15 | F14: 10 | G14: 10 | K14: =SUM(E14:J14) -> 35
A15: 39885 | B15: 7 | C15: Erik Feragen | D15: 3 | E15: 15 | F15: 10 | G15: 7 | K15: =SUM(E15:J15) -> 32
A16: 39919 | B16: 8 | C16: Sindre Brobakken | D16: 5 | E16: 10 | F16: 8 | G16: 7 | H16: 7 | I16: 0 | J16: 0 | K16: =SUM(E16:J16) -> 32
A17: 39947 | B17: 9 | C17: Stein Nordstrøm | D17: 3 | E17: 12 | F17: 9 | G17: 7 | H17: 3 | K17: =SUM(E17:J17) -> 31
A18: 40066 | B18: 10 | C18: Frode Kaveldiget | D18: 3 | E18: 8 | F18: 8 | G18: 6 | K18: =SUM(E18:J18) -> 22
A19: 40094 | B19: 11 | C19: Steinar Ormåsen | D19: 2 | E19: 10 | F19: 9 | K19: =SUM(E19:J19) -> 19
A20: 40115 | B20: 12 | C20: Espen Wasshaug | D20: 2 | E20: 10 | F20: 5 | K20: =SUM(E20:J20) -> 15
A21: 40129 | B21: 13 | C21: Vebjørn Olstad | D21: 5 | E21: 9 | F21: 4 | G21: 2 | K21: =SUM(E21:J21) -> 15
B22: 14 | C22: Leif Magne Moen | D22: 5 | E22: 8 | F22: 6 | K22: =SUM(E22:J22) -> 14
B23: 15 | C23: Trym Woldstad | D23: 4 | E23: 8 | F23: 5 | K23: =SUM(E23:J23) -> 13
B24: 16 | C24: Ida Rødvik | D24: 5 | E24: 7 | F24: 6 | K24: =SUM(E24:J24) -> 13
B25: 17 | C25: Thomas Nilsen | D25: 2 | E25: 8 | F25: 4 | K25: =SUM(E25:J25) -> 12
B26: 18 | C26: Knut Solberg | D26: 5 | E26: 7 | F26: 5 | K26: =SUM(E26:J26) -> 12
B27: 19 | C27: Ole Henrik Solberg | D27: 5 | E27: 6 | F27: 4 | K27: =SUM(E27:J27) -> 10
B28: 20 | C28: Ole-Jakob Kristiansen | D28: 1 | E28: 9 | K28: =SUM(E28:J28) -> 9
B29: 21 | C29: Tom Allsted | D29: 3 | E29: 7 | F29: 2 | K29: =SUM(E29:J29) -> 9
B30: 22 | C30: Jørgen Brobakken | D30: 5 | E30: 6 | F30: 3 | K30: =SUM(E30:J30) -> 9
B31: 23 | C31: Hogne Ormåsen | D31: 4 | E31: 8 | K31: =SUM(E31:J31) -> 8
B32: 24 | C32: Magnus Kristiansen | D32: 5 | E32: 7 | K32: =SUM(E32:J32) -> 7
B33: 25 | C33: Reidar Kristiansen | D33: 4 | E33: 5 | K33: =SUM(E33:J33) -> 5
B34: 26 | C34: Jose Andreas Pedersen | D34: 5 | E34: 3 | K34: =SUM(E34:J34) -> 3
B35: 26 | C35: Alise Haukenes | D35: 5 | E35: 3 | K35: =SUM(E35:J35) -> 3
B36: 28 | C36: Simen Blindheim | D36: 5 | E36: 2 | K36: =SUM(E36:J36) -> 2
B37: 29 | C37: Kristoffer Opsahl | D37: 5 | E37: 2 | K37: =SUM(E37:J37) -> 2
B38: 30 | C38: Jonas Haukenes | D38: 5 | E38: 1 | K38: =SUM(E38:J38) -> 1
B39: 30 | C39: Knut Arne Furuseth | D39: 5 | E39: 1 | K39: =SUM(E39:J39) -> 1
B40: 30 | C40: Frank Juliussen | D40: 4 | E40: 1 | F40: 0 | K40: =SUM(E40:J40) -> 1
B41: 30 | C41: Martin Kolloen | D41: 5 | E41: 1 | F41: 0 | K41: =SUM(E41:J41) -> 1
A42: 19 | B42: 34 | C42: Elias Haukenes | D42: 5 | E42: 0 | K42: =SUM(E42:J42) -> 0
B43: 34 | C43: Alexander Tangen | D43: 5 | E43: 0 | K43: =SUM(E43:J43) -> 0
B45: Gruppe inntil 1750
B47: Nr. | C47: Navn | D47: Kl. | E47: 1 | F47: 2 | G47: 3 | H47: 4 | I47: 5 | J47: 6 | K47: Poeng
B48: 1 | C48: Kristian Holm | D48: 2 | E48: 15 | F48: 15 | G48: 15 | H48: 15 | I48: 12 | J48: 12 | K48: =SUM(E48:J48) -> 84
B49: 2 | C49: Geir Brobakken | D49: 2 | E49: 15 | F49: 15 | G49: 10 | H49: 10 | I49: 8 | K49: =SUM(E49:J49) -> 58
B50: 3 | C50: Trym Daniel Rødvik | D50: 4 | E50: 15 | F50: 12 | G50: 9 | H50: 6 | I50: 1 | K50: =SUM(E50:J50) -> 43
B51: 4 | C51: Sindre Brobakken | D51: 5 | E51: 12 | F51: 9 | G51: 8 | H51: 7 | I51: 1 | J51: 0 | K51: =SUM(E51:J51) -> 37
B52: 5 | C52: Stein Nordstrøm | D52: 3 | E52: 12 | F52: 10 | G52: 9 | H52: 5 | K52: =SUM(E52:J52) -> 36
B53: 6 | C53: Erik Feragen | D53: 3 | E53: 15 | F53: 10 | G53: 9 | K53: =SUM(E53:J53) -> 34
B54: 7 | C54: Frode Kaveldiget | D54: 3 | E54: 10 | F54: 10 | G54: 8 | K54: =SUM(E54:J54) -> 28
B55: 8 | C55: Steinar Ormåsen | D55: 2 | E55: 12 | F55: 12 | K55: =SUM(E55:J55) -> 24
B56: 9 | C56: Espen Wasshaug | D56: 2 | E56: 12 | F56: 7 | K56: =SUM(E56:J56) -> 19
B57: 10 | C57: Vebjørn Olstad | D57: 5 | E57: 10 | F57: 6 | G57: 3 | K57: =SUM(E57:J57) -> 19
B58: 11 | C58: Trym Woldstad | D58: 4 | E58: 10 | F58: 7 | K58: =SUM(E58:J58) -> 17
B59: 12 | C59: Ida Rødvik | D59: 5 | E59: 9 | F59: 7 | K59: =SUM(E59:J59) -> 16
B60: 13 | C60: Leif Magne Moen | D60: 5 | E60: 8 | F60: 8 | K60: =SUM(E60:J60) -> 16
B61: 14 | C61: Thomas Nilsen | D61: 2 | E61: 9 | F61: 6 | K61: =SUM(E61:J61) -> 15
B62: 15 | C62: Knut Solberg | D62: 5 | E62: 8 | F62: 6 | K62: =SUM(E62:J62) -> 14
B63: 16 | C63: Tom Allsted | D63: 3 | E63: 8 | F63: 4 | K63: =SUM(E63:J63) -> 12
B64: 17 | C64: Jørgen Brobakken | D64: 5 | E64: 8 | F64: 4 | K64: =SUM(E64:J64) -> 12
B65: 18 | C65: Ole Henrik Solberg | D65: 5 | E65: 7 | F65: 5 | K65: =SUM(E65:J65) -> 12
B66: 19 | C66: Hogne Ormåsen | D66: 4 | E66: 9 | K66: =SUM(E66:J66) -> 9
B67: 20 | C67: Magnus Kristiansen | D67: 5 | E67: 9 | K67: =SUM(E67:J67) -> 9
B68: 21 | C68: Reidar Kristiansen | D68: 4 | E68: 7 | K68: =SUM(E68:J68) -> 7
B69: 22 | C69: Jose Andreas Pedersen | D69: 5 | E69: 5 | K69: =SUM(E69:J69) -> 5
B70: 21 | C70: Alise Haukenes | D70: 5 | E70: 5 | K70: =SUM(E70:J70) -> 5
B71: 24 | C71: Frank Juliussen | D71: 4 | E71: 3 | F71: 2 | K71: =SUM(E71:J71) -> 5
B72: 24 | C72: Martin Kolloen | D72: 5 | E72: 3 | F72: 2 | K72: =SUM(E72:J72) -> 5
B73: 26 | C73: Simen Blindheim | D73: 5 | E73: 4 | K73: =SUM(E73:J73) -> 4
B74: 27 | C74: Kristoffer Opsahl | D74: 5 | E74: 4 | K74: =SUM(E74:J74) -> 4
B75: 28 | C75: Knut Arne Furuseth | D75: 5 | E75: 3 | K75: =SUM(E75:J75) -> 3
B76: 29 | C76: Jonas Haukenes | D76: 5 | E76: 2 | K76: =SUM(E76:J76) -> 2
B77: 30 | C77: Alexander Tangen | D77: 5 | E77: 2 | K77: =SUM(E77:J77) -> 2
B78: 31 | C78: Elias Haukenes | D78: 5 | E78: 1 | K78: =SUM(E78:J78) -> 1
B80: Gruppe inntil 1500
B82: Nr. | C82: Navn | D82: Kl. | E82: 1 | F82: 2 | G82: 3 | H82: 4 | I82: 5 | J82: 6 | K82: Poeng
B83: 1 | C83: Trym Daniel Rødvik | D83: 4 | E83: 15 | F83: 15 | G83: 10 | H83: 9 | I83: 6 | K83: =SUM(E83:J83) -> 55
B84: 2 | C84: Sindre Brobakken | D84: 5 | E84: 15 | F84: 12 | G84: 10 | H84: 8 | I84: 5 | J84: 4 | K84: =SUM(E84:J84) -> 54
B85: 3 | C85: Stein Nordstrøm | D85: 3 | E85: 15 | F85: 12 | G85: 12 | H85: 8 | K85: =SUM(E85:J85) -> 47
B86: 4 | C86: Erik Feragen | D86: 3 | E86: 15 | F86: 15 | G86: 12 | K86: =SUM(E86:J86) -> 42
B87: 5 | C87: Frode Kaveldiget | D87: 3 | E87: 15 | F87: 12 | G87: 12 | K87: =SUM(E87:J87) -> 39
B88: 6 | C88: Vebjørn Olstad | D88: 5 | E88: 15 | F88: 7 | G88: 6 | K88: =SUM(E88:J88) -> 28
B89: 7 | C89: Trym Woldstad | D89: 4 | E89: 12 | F89: 10 | K89: =SUM(E89:J89) -> 22
B90: 8 | C90: Ida Rødvik | D90: 5 | E90: 10 | F90: 10 | K90: =SUM(E90:J90) -> 20
B91: 9 | C91: Knut Solberg | D91: 5 | E91: 10 | F91: 9 | K91: =SUM(E91:J91) -> 19
B92: 10 | C92: Leif Magne Moen | D92: 5 | E92: 9 | F92: 9 | K92: =SUM(E92:J92) -> 18
B93: 11 | C93: Ole Henrik Solberg | D93: 5 | E93: 9 | F93: 8 | K93: =SUM(E93:J93) -> 17
B94: 12 | C94: Tom Allsted | D94: 3 | E94: 9 | F94: 7 | K94: =SUM(E94:J94) -> 16
B95: 12 | C95: Jørgen Brobakken | D95: 5 | E95: 9 | F95: 7 | K95: =SUM(E95:J95) -> 16
B96: 14 | C96: Martin Kolloen | D96: 5 | E96: 8 | F96: 5 | K96: =SUM(E96:J96) -> 13
B97: 15 | C97: Frank Juliussen | D97: 4 | E97: 7 | F97: 6 | K97: =SUM(E97:J97) -> 13
B98: 16 | C98: Hogne Ormåsen | D98: 4 | E98: 12 | K98: =SUM(E98:J98) -> 12
B99: 17 | C99: Magnus Kristiansen | D99: 5 | E99: 10 | K99: =SUM(E99:J99) -> 10
B100: 17 | C100: Alise Haukenes | D100: 4 | E100: 10 | K100: =SUM(E100:J100) -> 10
B101: 19 | C101: Kristoffer Opsahl | D101: 4 | E101: 9 | K101: =SUM(E101:J101) -> 9
B102: 20 | C102: Reidar Kristiansen | D102: 4 | E102: 8 | K102: =SUM(E102:J102) -> 8
B103: 21 | C103: Jose Andreas Pedersen | D103: 5 | E103: 6 | K103: =SUM(E103:J103) -> 6
B104: 22 | C104: Jonas Haukenes | D104: 5 | E104: 5 | K104: =SUM(E104:J104) -> 5
B105: 22 | C105: Simen Blindheim | D105: 5 | E105: 5 | K105: =SUM(E105:J105) -> 5
B106: 24 | C106: Elias Haukenes | D106: 5 | E106: 4 | K106: =SUM(E106:J106) -> 4
B107: 24 | C107: Knut Arne Furuseth | D107: 5 | E107: 4 | K107: =SUM(E107:J107) -> 4
B108: 26 | C108: Alexander Tangen | D108: 5 | E108: 3 | K108: =SUM(E108:J108) -> 3
B110: Gruppe inntil 1250
B112: Nr. | C112: Navn | D112: Kl. | E112: 1 | F112: 2 | G112: 3 | H112: 4 | I112: 5 | J112: 6 | K112: Poeng
B113: 1 | C113: Sindre Brobakken | D113: 5 | E113: 15 | F113: 15 | G113: 12 | H113: 10 | I113: 8 | J113: 7 | K113: =SUM(E113:J113) -> 67
B114: 2 | C114: Trym Daniel Rødvik | D114: 4 | E114: 15 | F114: 15 | G114: 15 | H114: 12 | I114: 8 | K114: =SUM(E114:J114) -> 65
B115: 3 | C115: Vebjørn Olstad | D115: 5 | E115: 15 | F115: 7 | G115: 6 | K115: =SUM(E115:J115) -> 28
B116: 4 | C116: Trym Woldstad | D116: 4 | E116: 15 | F116: 12 | K116: =SUM(E116:J116) -> 27
B117: 5 | C117: Leif Magne Moen | D117: 5 | E117: 12 | F117: 10 | K117: =SUM(E117:J117) -> 22
B118: 6 | C118: Ida Rødvik | D118: 5 | E118: 12 | F118: 10 | K118: =SUM(E118:J118) -> 22
B119: 7 | C119: Frank Juliussen | D119: 4 | E119: 10 | F119: 9 | K119: =SUM(E119:J119) -> 19
B120: 7 | C120: Martin Kolloen | D120: 5 | E120: 10 | F120: 9 | K120: =SUM(E120:J120) -> 19
B121: 7 | C121: Knut Solberg | D121: 5 | E121: 10 | F121: 9 | K121: =SUM(E121:J121) -> 19
B122: 10 | C122: Ole Henrik Solberg | D122: 5 | E122: 9 | F122: 8 | K122: =SUM(E122:J122) -> 17
B123: 11 | C123: Jørgen Brobakken | D123: 5 | E123: 9 | F123: 7 | K123: =SUM(E123:J123) -> 16
B124: 12 | C124: Alise Haukenes | D124: 4 | E124: 15 | K124: =SUM(E124:J124) -> 15
B125: 13 | C125: Hogne Ormåsen | D125: 4 | E125: 12 | K125: =SUM(E125:J125) -> 12
B126: 13 | C126: Kristoffer Opsahl | D126: 4 | E126: 12 | K126: =SUM(E126:J126) -> 12
B127: 15 | C127: Magnus Kristiansen | D127: 5 | E127: 10 | K127: =SUM(E127:J127) -> 10
B128: 16 | C128: Reidar Kristiansen | D128: 4 | E128: 8 | K128: =SUM(E128:J128) -> 8
B129: 17 | C129: Jose Andreas Pedersen | D129: 5 | E129: 6 | K129: =SUM(E129:J129) -> 6
B130: 18 | C130: Jonas Haukenes | D130: 5 | E130: 5 | K130: =SUM(E130:J130) -> 5
B131: 18 | C131: Simen Blindheim | D131: 5 | E131: 5 | K131: =SUM(E131:J131) -> 5
B132: 20 | C132: Elias Haukenes | D132: 5 | E132: 4 | K132: =SUM(E132:J132) -> 4
B133: 20 | C133: Knut Arne Furuseth | D133: 5 | E133: 4 | K133: =SUM(E133:J133) -> 4
B134: 22 | C134: Alexander Tangen | D134: 5 | E134: 3 | K134: =SUM(E134:J134) -> 3
B136: Gruppe inntil 1000
B138: Nr. | C138: Navn | D138: Kl. | E138: 1 | F138: 2 | G138: 3 | H138: 4 | I138: 5 | J138: 6 | K138: Poeng
B139: 1 | C139: Sindre Brobakken | D139: 5 | E139: 15 | F139: 15 | G139: 15 | H139: 12 | I139: 12 | J139: 12 | K139: =SUM(E139:J139) -> 81
B140: 2 | C140: Vebjørn Olstad | D140: 5 | E140: 15 | F140: 9 | G140: 7 | K140: =SUM(E140:J140) -> 31
B141: 3 | C141: Martin Kolloen | D141: 5 | E141: 15 | F141: 15 | K141: =SUM(E141:J141) -> 30
B142: 4 | C142: Leif Magne Moen | D142: 5 | E142: 15 | F142: 12 | K142: =SUM(E142:J142) -> 27
B143: 4 | C143: Ida Rødvik | D143: 5 | E143: 15 | F143: 12 | K143: =SUM(E143:J143) -> 27
B144: 6 | C144: Knut Solberg | D144: 5 | E144: 12 | F144: 10 | K144: =SUM(E144:J144) -> 22
B145: 7 | C145: Ole Henrik Solberg | D145: 5 | E145: 10 | F145: 9 | K145: =SUM(E145:J145) -> 19
B146: 8 | C146: Jørgen Brobakken | D146: 5 | E146: 10 | F146: 8 | K146: =SUM(E146:J146) -> 18
B147: 9 | C147: Magnus Kristiansen | D147: 5 | E147: 12 | K147: =SUM(E147:J147) -> 12
B148: 10 | C148: Jose Andreas Pedersen | D148: 5 | E148: 8 | K148: =SUM(E148:J148) -> 8
B149: 11 | C149: Simen Blindheim | D149: 5 | E149: 7 | K149: =SUM(E149:J149) -> 7
B150: 12 | C150: Jonas Haukenes | D150: 5 | E150: 6 | K150: =SUM(E150:J150) -> 6
B151: 12 | C151: Knut Arne Furuseth | D151: 5 | E151: 6 | K151: =SUM(E151:J151) -> 6
B152: 14 | C152: Elias Haukenes | D152: 5 | E152: 5 | K152: =SUM(E152:J152) -> 5
B153: 14 | C153: Alexander Tangen | D153: 5 | E153: 5 | K153: =SUM(E153:J153) -> 5