C1: KLUBBMESTERSKAP LYNSJAKK 2002
B3: Nr | C3: Navn | D3: Klubb | E3: Rating | F3: R1 | G3: R2 | H3: R3 | I3: R4 | J3: R5 | K3: Poeng | L3: Kvalitet | N3: Bord | T3: Hovedside
B4: 1 | C4: Ragnar Holm | D4: Hamar | E4: 2298 | F4: 3 | G4: 3 | H4: 1 | I4: 2.5 | J4: 2.5 | K4: =SUM(F4:J4) -> 12 | N4: 3 | O4: 1 | P4: 1 | Q4: 1 | R4: 1 | T4: Hovedside turneringer
B5: 2 | C5: Lars Pilø | D5: Hamar | E5: 1969 | F5: 2 | G5: 3 | H5: 2 | I5: 1 | J5: 2 | K5: =SUM(F5:J5) -> 10 | N5: 3 | O5: 2 | P5: 1 | Q5: 1 | R5: 1 | T5: Oversikt over mestere
B6: 3 | C6: Jan Jotun | D6: Hamar | E6: 1778 | F6: 3 | G6: 1 | H6: 1 | I6: 3 | J6: 1.5 | K6: =SUM(F6:J6) -> 9.5 | N6: 1 | O6: 1 | P6: 1 | Q6: 2 | R6: 1 | T6: 2001
B7: 4 | C7: Trond Nilsen | D7: Hamar | E7: 1915 | F7: 2 | G7: 0 | H7: 3 | I7: 1 | J7: 3 | K7: =SUM(F7:J7) -> 9 | L7: =SUM(O7:R7) -> 8 | N7: 1 | O7: 1 | P7: 3 | Q7: 1 | R7: 3 | T7: 2003
B8: 5 | C8: Per-Christian Stenvaag | D8: Løten | E8: 1567 | F8: 1.5 | G8: 1.5 | H8: 2 | I8: 1 | J8: 3 | K8: =SUM(F8:J8) -> 9 | L8: =SUM(O8:R8) -> 9 | N8: 3 | O8: 2 | P8: 2 | Q8: 2 | R8: 3
B9: 6 | C9: Steinar Ormåsen | D9: Hamar | E9: 1658 | F9: 2 | G9: 0.5 | H9: 1.5 | I9: 3 | J9: 2 | K9: =SUM(F9:J9) -> 9 | L9: =SUM(O9:R9) -> 10 | N9: 2 | O9: 2 | P9: 3 | Q9: 3 | R9: 2
B10: 7 | C10: Geir Brobakken | D10: Hamar | E10: 1882 | F10: 3 | G10: 2 | H10: 2 | I10: 1.5 | J10: 0 | K10: =SUM(F10:J10) -> 8.5 | L10: =SUM(O10:R10) -> 4 | N10: 2 | O10: 1 | P10: 1 | Q10: 1 | R10: 1
B11: 8 | C11: Ole J. Kristiansen | D11: Hamar | E11: 1820 | F11: 2 | G11: 1 | H11: 2 | I11: 1.5 | J11: 2 | K11: =SUM(F11:J11) -> 8.5 | L11: =SUM(O11:R11) -> 9 | N11: 3 | O11: 2 | P11: 3 | Q11: 2 | R11: 2
B12: 9 | C12: Stein Nordstrøm | D12: Hamar | E12: 1529 | F12: 0.5 | G12: 3 | H12: 1 | I12: 2 | J12: 1 | K12: =SUM(F12:J12) -> 7.5 | N12: 3 | O12: 3 | P12: 2 | Q12: 3 | R12: 2
B13: 10 | C13: Anders Wågø | D13: Hamar | E13: 1368 | F13: 1 | G13: 2 | H13: 1 | I13: 2 | J13: 1 | K13: =SUM(F13:J13) -> 7 | L13: =SUM(O13:R13) -> 10 | N13: 1 | O13: 3 | P13: 2 | Q13: 3 | R13: 2
B14: 11 | C14: Per-Johnny Nygård | D14: Hamar | E14: 1398 | F14: 1 | G14: 2 | H14: 2 | I14: 0.5 | J14: 1.5 | K14: =SUM(F14:J14) -> 7 | L14: =SUM(O14:R14) -> 10 | N14: 2 | O14: 3 | P14: 2 | Q14: 2 | R14: 3
B15: 12 | C15: Erik Feragen | D15: Hamar | E15: 1249 | F15: 0 | G15: 1 | H15: 2 | I15: 2 | J15: 1.5 | K15: =SUM(F15:J15) -> 6.5 | L15: =SUM(O15:R15) -> 12 | N15: 2 | O15: 3 | P15: 3 | Q15: 3 | R15: 3
B16: 13 | C16: Leif Magne Moen | D16: Hamar | E16: 786 | F16: 0 | G16: 1 | H16: 0.5 | I16: 0 | J16: 0 | K16: =SUM(F16:J16) -> 1.5 | L16: =SUM(O16:R16) -> 12 | N16: 3 | O16: 3 | P16: 3 | Q16: 3 | R16: 3
B17: 14 | C17: Tom Arnesveen | D17: Hamar | F17: 0 | G17: 0 | H17: 0 | I17: 0 | J17: 0 | K17: =SUM(F17:J17) -> 0 | L17: =SUM(O17:R17) -> 12 | N17: 1 | O17: 3 | P17: 3 | Q17: 3 | R17: 3