A2: KLUBBMESTERSKAP HURTIGSJAKK 2005
C3: 4 BESTE AV 7 TELLER Sluttresultat
C5: Gruppe A
A7: 2004 | B7: Nr. | C7: Navn | D7: 1 | E7: 2 | F7: 3 | G7: 4 | H7: Poeng
A8: 2006 | B8: 1 | C8: Lars Pilö | D8: 15 | E8: 15 | F8: 15 | G8: 12 | H8: =SUM(D8:G8) -> 57
B9: 2 | C9: Nikolai Hoff | D9: 15 | E9: 15 | F9: 15 | G9: 10 | H9: =SUM(D9:G9) -> 55
A10: Hovedside turneringer | B10: 3 | C10: Geir Brobakken | D10: 12 | E10: 12 | F10: 9 | G10: 9 | H10: =SUM(D10:G10) -> 42
B11: 4 | C11: Jan Jotun | D11: 12 | E11: 10 | F11: 10 | G11: 9 | H11: =SUM(D11:G11) -> 41
A12: 38365 | B12: 5 | C12: Ragnar Holm | D12: 15 | E12: 12 | F12: 4 | G12: 1 | H12: =SUM(D12:G12) -> 32
A13: 38421 | B13: 6 | C13: Ole J Kristiansen | D13: 10 | E13: 8 | F13: 7 | G13: 7 | H13: =SUM(D13:G13) -> 32
A14: 38470 | B14: 7 | C14: Trond Nilsen | D14: 12 | E14: 6 | F14: 6 | G14: 5 | H14: =SUM(D14:G14) -> 29
A15: 38498 | B15: 8 | C15: Anders Wågø | D15: 10 | E15: 10 | F15: 6 | H15: =SUM(D15:G15) -> 26
A16: 38589 | B16: 9 | C16: Steinar Ormåsen | D16: 9 | E16: 8 | F16: 6 | G16: 3 | H16: =SUM(D16:G16) -> 26
A17: 38652 | B17: 10 | C17: Per Johnny Nygård | D17: 8 | E17: 6 | F17: 4 | G17: 4 | H17: =SUM(D17:G17) -> 22
A18: 38694 | B18: 11 | C18: Trond Nerland | D18: 9 | E18: 7 | F18: 5 | H18: =SUM(D18:G18) -> 21
B19: 12 | C19: Thomas Nilsen | D19: 8 | E19: 5 | F19: 4 | G19: 2 | H19: =SUM(D19:G19) -> 19
B20: 13 | C20: Stein Nordström | D20: 7 | E20: 6 | F20: 3 | G20: 2 | H20: =SUM(D20:G20) -> 18
B21: 14 | C21: Frank Juliussen | D21: 7 | E21: 6 | F21: 3 | G21: 0 | H21: =SUM(D21:G21) -> 16
B22: 15 | C22: Kjetil Sangen | D22: 5 | E22: 5 | F22: 3 | G22: 0 | H22: =SUM(D22:G22) -> 13
B23: 16 | C23: Knut Engli | D23: 9 | H23: =SUM(D23:G23) -> 9
B24: 17 | C24: Leif Magne Moen | D24: 5 | E24: 3 | H24: =SUM(D24:G24) -> 8
B25: 18 | C25: Jan Arne Bjerke | D25: 5 | H25: =SUM(D25:G25) -> 5
B26: 19 | C26: Kristoffer Opsahl | D26: 4 | E26: 0 | F26: 0 | G26: 0 | H26: =SUM(D26:G26) -> 4
B27: 20 | C27: Dan Doan Trinh Anh | D27: 4 | H27: =SUM(D27:G27) -> 4
B28: 21 | C28: Anders Wågø | D28: 3 | H28: =SUM(D28:G28) -> 3
B29: 22 | C29: Jan Børge Solbakken | D29: 2 | H29: =SUM(D29:G29) -> 2
B30: 23 | C30: Erik Feragen | D30: 1 | E30: 0 | F30: 0 | H30: =SUM(D30:G30) -> 1
B31: 24 | C31: Reidar Kristiansen | D31: 0 | H31: =SUM(D31:G31) -> 0
C32: Jonas Pedersen | D32: 0 | H32: =SUM(D32:G32) -> 0
C33: Gavril Gerebenes | D33: 0 | H33: =SUM(D33:G33) -> 0
C34: Lasse Hanssen | D34: 0 | H34: =SUM(D34:G34) -> 0
C35: Frode Fjeld | D35: 0 | H35: =SUM(D35:G35) -> 0
C36: Lars Korst | D36: 0 | H36: =SUM(D36:G36) -> 0
C37: Per Chr Stenvaag | D37: 0 | H37: =SUM(D37:G37) -> 0
C39: Gruppe B
B41: Pl. | C41: Navn | D41: 1 | E41: 2 | F41: 3 | G41: 4 | H41: Poeng
B42: 1 | C42: Anders Wågø | D42: 15 | E42: 15 | F42: 15 | G42: 12 | H42: =SUM(D42:G42) -> 57
B43: 2 | C43: Thomas Nilsen | D43: 15 | E43: 15 | F43: 15 | G43: 10 | H43: =SUM(D43:G43) -> 55
B44: 3 | C44: Per Johnny Nygård | D44: 12 | E44: 12 | F44: 12 | G44: 10 | H44: =SUM(D44:G44) -> 46
B45: 4 | C45: Stein Nordström | D45: 15 | E45: 9 | F45: 9 | G45: 9 | H45: =SUM(D45:G45) -> 42
B46: 5 | C46: Kjetil Sangen | D46: 12 | E46: 12 | F46: 9 | G46: 8 | H46: =SUM(D46:G46) -> 41
B47: 6 | C47: Frank Juliussen | D47: 12 | E47: 10 | F47: 10 | G47: 7 | H47: =SUM(D47:G47) -> 39
B48: 7 | C48: Kristoffer Opsahl | D48: 7 | E48: 7 | F48: 7 | G48: 7 | H48: =SUM(D48:G48) -> 28
B49: 8 | C49: Erik Feragen | D49: 9 | E49: 8 | F49: 4 | H49: =SUM(D49:G49) -> 21
B50: 9 | C50: Leif Magne Moen | D50: 10 | E50: 6 | H50: =SUM(D50:G50) -> 16
B51: 10 | C51: Jan Arne Bjerke | D51: 8 | E51: 7 | H51: =SUM(D51:G51) -> 15
B52: 11 | C52: Jan Børge Solbakken | D52: 10 | H52: =SUM(D52:G52) -> 10
C53: Dan Doan Trinh Anh | D53: 10 | H53: =SUM(D53:G53) -> 10
B54: 13 | C54: Lars Korst | D54: 9 | H54: =SUM(D54:G54) -> 9
B55: 14 | C55: Reidar Kristiansen | D55: 6 | H55: =SUM(D55:G55) -> 6
B56: 15 | C56: Per Chr Stenvaag | D56: 5 | H56: =SUM(D56:G56) -> 5
B57: 16 | C57: Jonas Pedersen | D57: 3 | H57: =SUM(D57:G57) -> 3
B58: 17 | C58: Gavril Gerebenes | D58: 2 | H58: =SUM(D58:G58) -> 2
B59: 18 | C59: Lasse Hanssen | D59: 1 | H59: =SUM(D59:G59) -> 1
B60: 19 | C60: Frode Fjeld | D60: 0 | H60: =SUM(D60:G60) -> 0