D2: KLUBBMESTERSKAP LYNSJAKK 2007
B6: Pl. | C6: Pl.B | D6: Navn | E6: Klubb | F6: Rating | G6: R1 | H6: R2 | I6: R3 | J6: R4 | K6: Poeng | L6: Kvalitet | N6: Bord | R6: Ny rating
A7: 2006 | B7: 1 | D7: Ragnar Holm | E7: Hamar | F7: 1957 | G7: 3 | H7: 3 | I7: 2.5 | J7: 2.5 | K7: =SUM(G7:J7) -> 11 | N7: 3 | O7: 1 | P7: 1 | Q7: 1 | R7: 1976
A8: 2008 | B8: 2 | D8: Lars Pilø | E8: Hamar | F8: 1903 | G8: 2 | H8: 3 | I8: 2.5 | J8: 1.5 | K8: =SUM(G8:J8) -> 9 | N8: 2 | O8: 2 | P8: 1 | Q8: 1 | R8: 1897
B9: 3 | D9: Dan Doan Trinh Anh | E9: Ottestad | F9: 1696 | G9: 3 | H9: 2 | I9: 0.5 | J9: 3 | K9: =SUM(G9:J9) -> 8.5 | N9: 2 | O9: 1 | P9: 1 | Q9: 2 | R9: 1753
A10: Hovedside turneringer | B10: 4 | D10: Geir Brobakken | E10: Hamar | F10: 1630 | G10: 2 | H10: 2 | I10: 2 | J10: 1.5 | K10: =SUM(G10:J10) -> 7.5 | L10: 5 | N10: 3 | O10: 2 | P10: 2 | Q10: 1 | R10: 1681
B11: 5 | D11: Trond Nerland | E11: Hamar | F11: 1580 | G11: 1 | H11: 2.5 | I11: 2 | J11: 2 | K11: =SUM(G11:J11) -> 7.5 | L11: 8 | N11: 4 | O11: 4 | P11: 2 | Q11: 2 | R11: 1609
B12: 6 | D12: Knut Engli | E12: Hamar | F12: 1652 | G12: 1 | H12: 2.5 | I12: 0.5 | J12: 3 | K12: =SUM(G12:J12) -> 7 | N12: 1 | O12: 3 | P12: 2 | Q12: 3 | R12: 1617
B13: 7 | D13: Thomas Nilsen | E13: Hamar | F13: 1374 | G13: 1 | H13: 3 | I13: 0.5 | J13: 2 | K13: =SUM(G13:J13) -> 6.5 | L13: 7 | N13: 3 | O13: 3 | P13: 1 | Q13: 3 | R13: 1418
B14: 8 | C14: 1 | D14: Kjetil Sangen | E14: Hamar | F14: 1475 | G14: 2 | H14: 0.5 | I14: 2 | J14: 2 | K14: =SUM(G14:J14) -> 6.5 | L14: 8 | N14: 1 | O14: 2 | P14: 3 | Q14: 3 | R14: 1483
B15: 9 | D15: Jan Jotun | E15: Ottestad | F15: 1648 | G15: 2 | H15: 0.5 | I15: 3 | J15: 0.5 | K15: =SUM(G15:J15) -> 6 | L15: 6 | M15: 1-0 | N15: 3 | O15: 2 | P15: 3 | Q15: 1 | R15: 1652
B16: 10 | D16: Trond Nilsen | E16: Hamar | F16: 1660 | G16: 3 | H16: 0 | I16: 2 | J16: 1 | K16: =SUM(G16:J16) -> 6 | L16: 6 | M16: 0-1 | N16: 1 | O16: 1 | P16: 3 | Q16: 2 | R16: 1640
B17: 11-12 | C17: 2-3 | D17: Stein Nordstrøm | E17: Hamar | F17: 1392 | G17: 0 | H17: 1 | I17: 2 | J17: 3 | K17: =SUM(G17:J17) -> 6 | L17: 9 | M17: 1-1 | N17: 1 | O17: 3 | P17: 3 | Q17: 3 | R17: 1395
B18: 11-12 | C18: 2-3 | D18: Per Johnny Nygård | E18: Hamar | F18: 1216 | G18: 1 | H18: 2 | I18: 2 | J18: 1 | K18: =SUM(G18:J18) -> 6 | L18: 9 | M18: 1-1 | N18: 2 | O18: 3 | P18: 3 | Q18: 3 | R18: 1281
B19: 13 | D19: Ole-Jakob Kristiansen | E19: Hamar | F19: 1760 | G19: 3 | H19: 1 | I19: 1.5 | J19: 0 | K19: =SUM(G19:J19) -> 5.5 | N19: 3 | O19: 1 | P19: 2 | Q19: 2 | R19: 1708
B20: 14 | D20: Ole Bækken | E20: Elverum | F20: 1231 | G20: 0 | H20: 1 | I20: 1 | J20: 0 | K20: =SUM(G20:J20) -> 2 | N20: 3 | O20: 3 | P20: 3 | Q20: 3 | R20: 1237
B21: 15 | D21: Anders Wågø | E21: Hamar | F21: 1738 | G21: 0 | H21: 0 | I21: 0 | J21: 1 | K21: =SUM(G21:J21) -> 1 | N21: 2 | O21: 3 | P21: 3 | Q21: 3 | R21: 1561