D2: KLUBBMESTERSKAP LYNSJAKK 2005
B6: Pl. | C6: Pl.B | D6: Navn | E6: Klubb | F6: Rating | G6: R1 | H6: R2 | I6: R3 | J6: R4 | K6: R5 | L6: Poeng | M6: Kvalitet | O6: Bord | T6: Ny rating
A7: 2004 | B7: 1 | D7: Ragnar Holm | E7: Hamar | F7: 2021 | G7: 3 | H7: 3 | I7: 3 | J7: 2.5 | K7: 1.5 | L7: =SUM(G7:K7) -> 13 | O7: 4 | P7: 1 | Q7: 1 | R7: 1 | S7: 1 | T7: 2034
A8: 2006 | B8: 2 | D8: Nikolai Hoff | E8: Hamar | F8: 1822 | G8: 3 | H8: 2 | I8: 1 | J8: 3 | K8: 2 | L8: =SUM(G8:K8) -> 11 | O8: 1 | P8: 1 | Q8: 1 | R8: 2 | S8: 1 | T8: 1870
B9: 3 | D9: Lars Pilø | E9: Hamar | F9: 1926 | G9: 2 | H9: 3 | I9: 1.5 | J9: 1.5 | K9: 2 | L9: =SUM(G9:K9) -> 10 | O9: 3 | P9: 3 | Q9: 1 | R9: 1 | S9: 1 | T9: 1902
A10: Hovedside turneringer | B10: 4 | D10: Trond Nerland | E10: Hamar | F10: 1622 | G10: 1 | H10: 2 | I10: 0.5 | J10: 3 | K10: 3 | L10: =SUM(G10:K10) -> 9.5 | O10: 5 | P10: 5 | Q10: 3 | R10: 4 | S10: 3 | T10: 1613
B11: 5 | D11: Anders Wågø | E11: Hamar | F11: 1719 | G11: 2 | H11: 2 | I11: 2 | J11: 1 | K11: 2 | L11: =SUM(G11:K11) -> 9 | M11: 5 | O11: 2 | P11: 2 | Q11: 2 | R11: 1 | S11: 2 | T11: 1728
B12: 6 | D12: Jan Jotun | E12: Hamar | F12: 1677 | G12: 1 | H12: 2 | I12: 2 | J12: 2 | K12: 2 | L12: =SUM(G12:K12) -> 9 | M12: 8 | O12: 5 | P12: 4 | Q12: 3 | R12: 3 | S12: 2 | T12: 1660
B13: 7 | D13: Knut Engli | E13: Hamar | F13: 1702 | G13: 3 | H13: 1 | I13: 3 | J13: 1 | K13: 0.5 | L13: =SUM(G13:K13) -> 8.5 | M13: 4 | O13: 3 | P13: 1 | Q13: 2 | R13: 1 | S13: 1 | T13: 1744
B14: 8 | D14: Trond Nilsen | E14: Hamar | F14: 1677 | G14: 2.5 | H14: 2.5 | I14: 0.5 | J14: 0 | K14: 3 | L14: =SUM(G14:K14) -> 8.5 | M14: 7 | O14: 5 | P14: 2 | Q14: 1 | R14: 2 | S14: 4 | T14: 1712
B15: 9 | D15: Per Svingen | E15: Hamar | F15: 1734 | G15: 2.5 | H15: 0 | I15: 3 | J15: 2 | K15: 1 | L15: =SUM(G15:K15) -> 8.5 | M15: 8 | N15: 1-0 | O15: 5 | P15: 1 | Q15: 4 | R15: 2 | S15: 2 | T15: 1731
B16: 10 | D16: Ole J Kristiansen | E16: Hamar | F16: 1746 | G16: 2 | H16: 1 | I16: 2.5 | J16: 1 | K16: 2 | L16: =SUM(G16:K16) -> 8.5 | M16: 8 | N16: 0-1 | O16: 2 | P16: 2 | Q16: 3 | R16: 2 | S16: 3 | T16: 1707
B17: 11 | D17: Geir Brobakken | E17: Hamar | F17: 1727 | G17: 2 | H17: 0.5 | I17: 2 | J17: 3 | K17: 1 | L17: =SUM(G17:K17) -> 8.5 | M17: 9 | O17: 1 | P17: 2 | Q17: 4 | R17: 3 | S17: 2 | T17: 1703
B18: 12 | C18: 1 | D18: Per-Chr Stenvaag | E18: Løten | F18: 1346 | G18: 1 | H18: 0 | I18: 2 | J18: 1 | K18: 3 | L18: =SUM(G18:K18) -> 7 | O18: 3 | P18: 4 | Q18: 5 | R18: 5 | S18: 5 | T18: 1351
B19: 13 | C19: 2 | D19: Kjetil Sangen | E19: Hamar | F19: 1308 | G19: 1.5 | H19: 2 | I19: 0 | J19: 2 | K19: 1 | L19: =SUM(G19:K19) -> 6.5 | M19: 9 | O19: 4 | P19: 4 | Q19: 2 | R19: 4 | S19: 3 | T19: 1373
B20: 14 | D20: Steinar Ormåsen | E20: Hamar | F20: 1635 | G20: 0 | H20: 1.5 | I20: 3 | J20: 1 | K20: 1 | L20: =SUM(G20:K20) -> 6.5 | M20: 12 | O20: 4 | P20: 5 | Q20: 5 | R20: 3 | S20: 4 | T20: 1557
B21: 15 | C21: 3 | D21: Lars Korst | E21: Ottestad | F21: 1375 | G21: 1 | H21: 2 | I21: 1 | J21: 1 | K21: 1 | L21: =SUM(G21:K21) -> 6 | M21: 12 | O21: 1 | P21: 4 | Q21: 3 | R21: 4 | S21: 5 | T21: 1392
B22: 16 | C22: 4 | D22: Erik Feragen | E22: Hamar | F22: 1272 | G22: 0 | H22: 2 | I22: 1 | J22: 2 | K22: 1 | L22: =SUM(G22:K22) -> 6 | M22: 13 | O22: 1 | P22: 5 | Q22: 4 | R22: 5 | S22: 4 | T22: 1314
B23: 17 | C23: 5-6 | D23: Jan B Solbakken | E23: Ottestad | F23: 1411 | G23: 2 | H23: 0 | I23: 1 | J23: 2 | K23: 1 | L23: =SUM(G23:K23) -> 6 | M23: 14 | N23: 2-0 | O23: 2 | P23: 3 | Q23: 5 | R23: 5 | S23: 4 | T23: 1400
B24: 17 | C24: 5-6 | D24: Per J Nygård | E24: Hamar | F24: 1457 | G24: 0 | H24: 2 | I24: 2 | J24: 0 | K24: 2 | L24: =SUM(G24:K24) -> 6 | M24: 14 | N24: 1-0 | O24: 3 | P24: 5 | Q24: 5 | R24: 4 | S24: 5 | T24: 1420
B25: 19 | C25: 7 | D25: Thomas Nilsen | E25: Hamar | F25: 1543 | G25: 2 | H25: 1 | I25: 0 | J25: 1 | K25: 2 | L25: =SUM(G25:K25) -> 6 | M25: 14 | N25: 0-3 | O25: 5 | P25: 3 | Q25: 4 | R25: 5 | S25: 5 | T25: 1480
B26: 20 | C26: 8 | D26: Stein Nordstrøm | E26: Hamar | F26: 1485 | G26: 1.5 | H26: 2 | I26: 1 | J26: 0 | K26: 1 | L26: =SUM(G26:K26) -> 5.5 | M26: 10 | O26: 4 | P26: 3 | Q26: 2 | R26: 3 | S26: 5 | T26: 1472
B27: 21 | C27: 9 | D27: Jan Arne Bjerke | E27: Hamar | F27: 1188 | G27: 0 | H27: 1.5 | I27: 1 | J27: 3 | K27: 0 | L27: =SUM(G27:K27) -> 5.5 | M27: 13 | O27: 2 | P27: 5 | Q27: 5 | R27: 5 | S27: 3 | T27: 1226