C1: KLUBBMESTERSKAP LYNSJAKK 2001
B3: Nr | C3: Navn | D3: Klubb | E3: Rating | F3: R1 | G3: R2 | H3: R3 | I3: R4 | J3: R5 | K3: Poeng | L3: Kvalitet | N3: Bord | T3: Hovedside
B4: 1 | C4: Ragnar Holm | D4: Hamar | E4: 2251 | F4: 3 | G4: 3 | H4: 3 | I4: 3 | J4: 3 | K4: =SUM(F4:J4) -> 15 | N4: 3 | O4: 1 | P4: 1 | Q4: 1 | R4: 1 | T4: Hovedside turneringer
B5: 2 | C5: Lars Pilø | D5: Hamar | E5: 1919 | F5: 3 | G5: 0 | H5: 3 | I5: 1.5 | J5: 2.5 | K5: =SUM(F5:J5) -> 10 | N5: 2 | O5: 1 | P5: 3 | Q5: 1 | R5: 2 | T5: Oversikt over mestere
B6: 3 | C6: Jan Jotun | D6: Hamar | E6: 1799 | F6: 2 | G6: 2 | H6: 1.5 | I6: 2 | J6: 2 | K6: =SUM(F6:J6) -> 9.5 | N6: 1 | O6: 1 | P6: 1 | Q6: 2 | R6: 1 | T6: 2000
B7: 4 | C7: Trond Nerland | D7: Hamar | E7: 1666 | F7: 1 | G7: 2.5 | H7: 2.5 | I7: 2 | J7: 1 | K7: =SUM(F7:J7) -> 9 | N7: 2 | O7: 3 | P7: 2 | Q7: 2 | R7: 1 | T7: 2002
B8: 5 | C8: Jan Børge Solbakken | D8: Ottestad | E8: 1514 | F8: 0.5 | G8: 2.5 | H8: 1 | I8: 3 | J8: 1.5 | K8: =SUM(F8:J8) -> 8.5 | N8: 2 | O8: 3 | P8: 2 | Q8: 3 | R8: 2
B9: 6 | C9: Per Svingen | D9: Hamar | E9: 1811 | F9: 2 | G9: 3 | H9: 1.5 | I9: 1.5 | J9: 0 | K9: =SUM(F9:J9) -> 8 | L9: 5 | N9: 3 | O9: 2 | P9: 1 | Q9: 1 | R9: 1
B10: 7 | C10: Ole J Kristiansen | D10: Hamar | E10: 1877 | F10: 3 | G10: 1 | H10: 0 | I10: 2 | J10: 2 | K10: =SUM(F10:J10) -> 8 | L10: 7 | N10: 1 | O10: 1 | P10: 1 | Q10: 3 | R10: 2
B11: 8 | C11: Geir Brobakken | D11: Hamar | E11: 1858 | F11: 1.5 | G11: 1 | H11: 1 | I11: 1.5 | J11: 3 | K11: =SUM(F11:J11) -> 8 | L11: 11 | N11: 2 | O11: 2 | P11: 3 | Q11: 3 | R11: 3
B12: 9 | C12: Trond Nilsen | D12: Hamar | E12: 1779 | F12: 1 | G12: 1 | H12: 2 | I12: 1.5 | J12: 2 | K12: =SUM(F12:J12) -> 7.5 | N12: 1 | O12: 2 | P12: 3 | Q12: 2 | R12: 3
B13: 10 | C13: Steinar Ormåsen | D13: Hamar | E13: 1790 | F13: 1 | G13: 2 | H13: 1.5 | I13: 0.5 | J13: 2 | K13: =SUM(F13:J13) -> 7 | N13: 3 | O13: 3 | P13: 2 | Q13: 2 | R13: 3
B14: 11 | C14: Per-Chr. Stenvaag | D14: Løten | E14: 1650 | F14: 2 | G14: 1 | H14: 3 | I14: 0 | J14: 0 | K14: =SUM(F14:J14) -> 6 | N14: 3 | O14: 2 | P14: 3 | Q14: 1 | R14: 2
B15: 12 | C15: Kolbjørn Brekstad | D15: Hamar | E15: 1536 | F15: 1 | G15: 2 | H15: 1 | K15: =SUM(F15:J15) -> 4 | N15: 3 | O15: 3 | P15: 2 | Q15: 3 | R15: 3
B16: 13 | C16: Rune Søraker | D16: Ottestad | E16: 1291 | F16: 0 | G16: 0 | H16: 0 | I16: 1.5 | J16: 1 | K16: =SUM(F16:J16) -> 2.5 | N16: 1 | O16: 3 | P16: 3 | Q16: 3 | R16: 3
B17: 14 | C17: Espen Smidesang | D17: Ottestad | E17: 1271 | F17: 0 | G17: 0 | H17: 0 | I17: 1 | J17: 1 | K17: =SUM(F17:J17) -> 2 | N17: 3 | O17: 3 | P17: 3 | Q17: 3 | R17: 3