B2: KLUBBMESTERSKAP HURTIGSJAKK 2006
D3: 8 beste turneringer av 12 teller
D4: Sluttresultat
E6: Gruppe A
A8: 2005 | B8: Nr. | C8: Navn | D8: 1 | E8: 2 | F8: 3 | G8: 4 | H8: 5 | I8: 6 | J8: 7 | K8: 8 | L8: Poeng
A9: 2007 | B9: 1 | C9: Ragnar Holm | D9: 15 | E9: 15 | F9: 15 | G9: 15 | H9: 15 | I9: 15 | J9: 12 | K9: 12 | L9: =SUM(D9:K9) -> 114
B10: 2 | C10: Geir Brobakken | D10: 15 | E10: 15 | F10: 12 | G10: 10 | H10: 9 | I10: 9 | J10: 9 | K10: 8 | L10: =SUM(D10:K10) -> 87
A11: Hovedside turneringer | B11: 3 | C11: Jan Jotun | D11: 15 | E11: 12 | F11: 12 | G11: 10 | H11: 10 | I11: 10 | J11: 9 | K11: 9 | L11: =SUM(D11:K11) -> 87
B12: 4 | C12: Trond Nilsen | D12: 15 | E12: 12 | F12: 12 | G12: 10 | H12: 10 | I12: 9 | J12: 9 | K12: 7 | L12: =SUM(D12:K12) -> 84
A13: 38729 | B13: 5 | C13: Stein Nordstrøm | D13: 12 | E13: 12 | F13: 9 | G13: 8 | H13: 7 | I13: 6 | J13: 6 | K13: 5 | L13: =SUM(D13:K13) -> 65
A14: 38757 | B14: 6 | C14: Lars Pilø | D14: 12 | E14: 10 | F14: 8 | G14: 8 | H14: 8 | I14: 0.5 | L14: =SUM(D14:K14) -> 46.5
A15: 38785 | B15: 7 | C15: Frank Juliussen | D15: 8 | E15: 8 | F15: 6 | G15: 5 | H15: 5 | I15: 4 | J15: 4 | K15: 4 | L15: =SUM(D15:K15) -> 44
A16: 38806 | B16: 8 | C16: Kjetil Sangen | D16: 10 | E16: 6 | F16: 6 | G16: 6 | H16: 4 | I16: 4 | J16: 3 | K16: 3 | L16: =SUM(D16:K16) -> 42
A17: 38834 | B17: 9 | C17: Steinar Ormåsen | D17: 12 | E17: 8 | F17: 8 | G17: 8 | H17: 4 | L17: =SUM(D17:K17) -> 40
A18: 38855 | B18: 10 | C18: Ole J Kristiansen | D18: 15 | E18: 10 | F18: 7 | L18: =SUM(D18:K18) -> 32
A19: 38953 | B19: 11 | C19: Trond Nerland | D19: 12 | E19: 8 | F19: 7 | L19: =SUM(D19:K19) -> 27
A20: 38974 | B20: 12 | C20: Ole Bækken | D20: 9 | E20: 7 | F20: 6 | G20: 4 | H20: 1 | L20: =SUM(D20:K20) -> 27
A21: 38988 | B21: 13 | C21: Per J Nygård | D21: 7 | E21: 5 | F21: 4 | G21: 3 | H21: 3 | I21: 2 | J21: 2 | K21: 1 | L21: =SUM(D21:K21) -> 27
A22: 39016 | B22: 14 | C22: Nikolai Hoff | D22: 15 | E22: 6 | L22: =SUM(D22:K22) -> 21
A23: 39044 | B23: 15 | C23: Frode Kaveldiget | D23: 9 | E23: 7 | F23: 3 | L23: =SUM(D23:K23) -> 19
A24: 39065 | B24: 16 | C24: Erik Feragen | D24: 6 | E24: 5 | F24: 3 | G24: 2 | L24: =SUM(D24:K24) -> 16
B25: 17 | C25: Frode Storli | D25: 9 | E25: 7 | L25: =SUM(D25:K25) -> 16
B26: 18 | C26: Thomas Nilsen | D26: 10 | E26: 5 | L26: =SUM(D26:K26) -> 15
B27: 19 | C27: Terje Benjaminsen | D27: 7 | E27: 4 | F27: 1 | L27: =SUM(D27:K27) -> 12
B28: 20 | C28: Doan Trinh Anh | D28: 10 | E28: 1 | F28: 0 | L28: =SUM(D28:K28) -> 11
B29: 21 | C29: Lasse Hanssen | D29: 4 | E29: 3 | F29: 2 | G29: 0 | L29: =SUM(D29:K29) -> 9
B30: 22 | C30: Kristoffer Opsahl | D30: 6 | E30: 2 | F30: 0.5 | G30: 0.5 | H30: 0 | I30: 0 | L30: =SUM(D30:K30) -> 9
B31: 23 | C31: Erlend Pilø | D31: 6 | E31: 3 | L31: =SUM(D31:K31) -> 9
B32: 24 | C32: Trond Nerland | D32: 5 | E32: 1 | L32: =SUM(D32:K32) -> 6
B33: 25 | C33: Anders Wågø | D33: 5 | L33: =SUM(D33:K33) -> 5
B34: 26 | C34: Kai Müller | D34: 3 | E34: 2 | L34: =SUM(D34:K34) -> 5
B35: 27 | C35: Drew Taylor | D35: 3 | L35: =SUM(D35:K35) -> 3
B36: 28 | C36: Lars Theis | D36: 2 | E36: 1 | F36: 0 | G36: 0 | H36: 0 | L36: =SUM(D36:K36) -> 3
B37: 29 | C37: Kristoffer Örnefeldt | D37: 2 | L37: =SUM(D37:K37) -> 2
C38: Leif Magne Moen | D38: 2 | L38: =SUM(D38:K38) -> 2
B39: 31 | C39: Reidar Kristiansen | D39: 1 | L39: =SUM(D39:K39) -> 1
B40: 32 | C40: Rune Hviding | D40: 0 | L40: =SUM(D40:K40) -> 0
C41: Knut Engli | D41: 0 | L41: =SUM(D41:K41) -> 0
C42: Inge Jacobsen | D42: 0 | L42: =SUM(D42:K42) -> 0
E44: Gruppe B
B46: Pl. | C46: Navn | D46: 1 | E46: 2 | F46: 3 | G46: 4 | H46: 5 | I46: 6 | J46: 7 | K46: 8 | L46: Poeng
B47: 1 | C47: Stein Nordstrøm | D47: 15 | E47: 15 | F47: 15 | G47: 15 | H47: 15 | I47: 15 | J47: 12 | K47: 12 | L47: =SUM(D47:K47) -> 114
B48: 2 | C48: Kjetil Sangen | D48: 15 | E48: 15 | F48: 12 | G48: 12 | H48: 10 | I48: 10 | J48: 9 | K48: 9 | L48: =SUM(D48:K48) -> 92
B49: 3 | C49: Frank Juliussen | D49: 15 | E49: 12 | F49: 12 | G49: 10 | H49: 10 | I49: 10 | J49: 10 | K49: 9 | L49: =SUM(D49:K49) -> 88
B50: 4 | C50: Per J Nygård | D50: 15 | E50: 10 | F50: 10 | G50: 9 | H50: 7 | I50: 7 | J50: 7 | K50: 7 | L50: =SUM(D50:K50) -> 72
B51: 5 | C51: Ole Bækken | D51: 12 | E51: 12 | F51: 10 | G51: 8 | H51: 6 | L51: =SUM(D51:K51) -> 48
B52: 6 | C52: Kristoffer Opsahl | D52: 9 | E52: 8 | F52: 8 | G52: 7 | H52: 5 | I52: 5 | L52: =SUM(D52:K52) -> 42
B53: 7 | C53: Erik Feragen | D53: 10 | E53: 9 | F53: 9 | G53: 8 | L53: =SUM(D53:K53) -> 36
B54: 8 | C54: Frode Kaveldiget | D54: 15 | E54: 12 | F54: 8 | L54: =SUM(D54:K54) -> 35
B55: 9 | C55: Lasse Hanssen | D55: 9 | E55: 8 | F55: 8 | G55: 6 | L55: =SUM(D55:K55) -> 31
B56: 10 | C56: Lars Theis | D56: 7 | E56: 6 | F56: 6 | G56: 6 | H56: 5 | L56: =SUM(D56:K56) -> 30
B57: 11 | C57: Terje Benjaminsen | D57: 10 | E57: 9 | F57: 9 | L57: =SUM(D57:K57) -> 28
B58: 12 | C58: Doan Trinh Anh | D58: 15 | E58: 7 | F58: 5 | L58: =SUM(D58:K58) -> 27
B59: 13 | C59: Frode Storli | D59: 12 | E59: 12 | L59: =SUM(D59:K59) -> 24
B60: 14 | C60: Erlend Pilø | D60: 10 | E60: 6 | L60: =SUM(D60:K60) -> 16
B61: 15 | C61: Kai Müller | D61: 8 | E61: 6 | L61: =SUM(D61:K61) -> 14
B62: 16 | C62: Kristoffer Örnefeldt | D62: 9 | L62: =SUM(D62:K62) -> 9
B63: 17 | C63: Leif Magne Moen | D63: 8 | L63: =SUM(D63:K63) -> 8
B64: 18 | C64: Drew Taylor | D64: 7 | L64: =SUM(D64:K64) -> 7
C65: Reidar Kristiansen | D65: 7 | L65: =SUM(D65:K65) -> 7
B66: 17 | C66: Rune Hviding | D66: 5 | L66: =SUM(D66:K66) -> 5
B67: 18 | C67: Inge Jacobsen | D67: 4 | L67: =SUM(D67:K67) -> 4