B2: KLUBBMESTERSKAP HURTIGSJAKK 2007
B3: 6 beste turneringer av 8 teller
B5: Sluttresultat
B7: Klubbmesterskapet
A9: 2006 | B9: Nr. | C9: Navn | D9: Kl. | E9: 1 | F9: 2 | G9: 3 | H9: 4 | I9: 5 | J9: 6 | K9: Poeng
A10: 2008 | B10: 1 | C10: Ragnar Holm | D10: M | E10: 15 | F10: 15 | G10: 15 | H10: 15 | I10: 12 | J10: 10 | K10: =SUM(E10:J10) -> 82
B11: 2 | C11: Geir Brobakken | D11: 2 | E11: 12 | F11: 12 | G11: 10 | H11: 8 | I11: 7 | J11: 6 | K11: =SUM(E11:J11) -> 55
A12: Hovedside turneringer | B12: 3 | C12: Lars Pilø | D12: 1 | E12: 15 | F12: 15 | G12: 7 | H12: 3 | K12: =SUM(E12:J12) -> 40
B13: 4 | C13: Dan Doan Trinh Anh | D13: 2 | E13: 15 | F13: 12 | G13: 9 | K13: =SUM(E13:J13) -> 36
A14: 39093 | B14: 5 | C14: Jan Jotun | D14: 2 | E14: 12 | F14: 10 | G14: 8 | H14: 6 | I14: 0 | K14: =SUM(E14:J14) -> 36
A15: 39121 | B15: 6 | C15: Ole Bækken | D15: 3 | E15: 8 | F15: 6 | G15: 6 | H15: 5 | I15: 4 | J15: 1 | K15: =SUM(E15:J15) -> 30
A16: 39149 | B16: 7 | C16: Frode Kaveldiget | D16: 2 | E16: 12 | F16: 5 | G16: 5 | H16: 3 | I16: 1 | J16: 0 | K16: =SUM(E16:J16) -> 26
A17: 39184 | B17: 8 | C17: Steinar Ormåsen | D17: 2 | E17: 9 | F17: 9 | G17: 7 | K17: =SUM(E17:J17) -> 25
A18: 39338 | B18: 9 | C18: Jon Kåre Myrene | D18: 1 | E18: 15 | F18: 9 | K18: =SUM(E18:J18) -> 24
A19: 39366 | B19: 10 | C19: Trond Nilsen | D19: 1 | E19: 12 | F19: 10 | K19: =SUM(E19:J19) -> 22
A20: 39394 | B20: 11 | C20: Trond Nerland | D20: 2 | E20: 10 | F20: 8 | G20: 4 | K20: =SUM(E20:J20) -> 22
A21: 39429 | B21: 12 | C21: Kristian Holm | D21: 4 | E21: 9 | F21: 7 | G21: 3 | H21: 2 | I21: 0 | K21: =SUM(E21:J21) -> 21
B22: 13 | C22: Tom Allsted | D22: 3 | E22: 9 | F22: 6 | G22: 4 | H22: 1 | K22: =SUM(E22:J22) -> 20
B23: 14 | C23: Fredrik Natvik | D23: 3 | E23: 12 | F23: 7 | K23: =SUM(E23:J23) -> 19
B24: 15 | C24: Frode Storli | D24: 3 | E24: 10 | F24: 5 | G24: 3 | H24: 1 | K24: =SUM(E24:J24) -> 19
B25: 16 | C25: Stein Nordstrøm | D25: 3 | E25: 10 | F25: 5 | G25: 2 | H25: 2 | K25: =SUM(E25:J25) -> 19
B26: 17 | C26: Espen Wasshaug | D26: 3 | E26: 10 | F26: 8 | K26: =SUM(E26:J26) -> 18
B27: 18 | C27: Ole J Kristiansen | D27: 1 | E27: 8 | F27: 7 | K27: =SUM(E27:J27) -> 15
B28: 19 | C28: Trym Daniel Rødvik | D28: 5 | E28: 6 | F28: 6 | G28: 2 | H28: 1 | I28: 0 | J28: 0 | K28: =SUM(E28:J28) -> 15
B29: 20 | C29: Erik Feragen | D29: 3 | E29: 8 | F29: 6 | G29: 0 | K29: =SUM(E29:J29) -> 14
B30: 21 | C30: Per Johnny Nygård | D30: 4 | E30: 5 | F30: 4 | G30: 1 | K30: =SUM(E30:J30) -> 10
B31: 22 | C31: Kai Müller | D31: 3 | E31: 9 | K31: =SUM(E31:J31) -> 9
B32: 22 | C32: Knut Engli | D32: 2 | E32: 9 | K32: =SUM(E32:J32) -> 9
B33: 24 | C33: Sindre Brobakken | D33: 5 | E33: 4 | F33: 3 | G33: 2 | H33: 0 | I33: 0 | K33: =SUM(E33:J33) -> 9
B34: 25 | C34: Erlend Pilø | D34: 4 | E34: 8 | F34: 0 | G34: 0 | K34: =SUM(E34:J34) -> 8
B35: 26 | C35: Trym Woldstad | D35: 5 | E35: 7 | F35: 0 | G35: 0 | K35: =SUM(E35:J35) -> 7
B36: 27 | C36: Jan Børge Solbakken | D36: 2 | E36: 7 | K36: =SUM(E36:J36) -> 7
B37: 28 | C37: Lars Kr. Telle | D37: 5 | E37: 5 | K37: =SUM(E37:J37) -> 5
B38: 28 | C38: Kristoffer Opsahl | D38: 5 | E38: 5 | K38: =SUM(E38:J38) -> 5
B39: 30 | C39: Erik Lie | D39: 1 | E39: 4 | K39: =SUM(E39:J39) -> 4
B40: 31 | C40: Anders Wågø | D40: 3 | E40: 3 | F40: 0 | K40: =SUM(E40:J40) -> 3
B41: 32 | C41: Lasse Hanssen | D41: 5 | E41: 2 | K41: =SUM(E41:J41) -> 2
B42: 33 | C42: Jens Solheim | D42: 5 | E42: 1 | F42: 0 | K42: =SUM(E42:J42) -> 1
B43: 34 | C43: Ådne Iversen | D43: 5 | E43: 0 | F43: 0 | G43: 0 | K43: =SUM(E43:J43) -> 0
B44: 35 | C44: Morgan Henriksen | D44: 3 | E44: 0 | F44: 0 | K44: =SUM(E44:J44) -> 0
B45: 36 | C45: Alise Haukenes | D45: 5 | E45: 0 | K45: =SUM(E45:J45) -> 0
B46: 36 | C46: Reidar Kristiansen | D46: 4 | E46: 0 | K46: =SUM(E46:J46) -> 0
B47: 36 | C47: Tom Arnesveen | D47: 5 | E47: 0 | K47: =SUM(E47:J47) -> 0
B48: 36 | C48: Ole Henrik Saxrud | D48: 4 | E48: 0 | K48: =SUM(E48:J48) -> 0
B49: 36 | C49: Ørjan Saxrud | D49: 5 | E49: 0 | K49: =SUM(E49:J49) -> 0
B50: 36 | C50: Håkon Saxrud | D50: 5 | E50: 0 | K50: =SUM(E50:J50) -> 0
B51: 36 | C51: Simen Haugen | D51: 5 | E51: 0 | K51: =SUM(E51:J51) -> 0
B53: Gruppe inntil 1750
B55: Nr. | C55: Navn | D55: Kl. | E55: 1 | F55: 2 | G55: 3 | H55: 4 | I55: 5 | J55: 6 | K55: Poeng
B56: 1 | C56: Geir Brobakken | D56: 2 | E56: 15 | F56: 15 | G56: 12 | H56: 10 | I56: 9 | J56: 8 | K56: =SUM(E56:J56) -> 69
B57: 2 | C57: Jan Jotun | D57: 2 | E57: 15 | F57: 12 | G57: 10 | H57: 8 | I57: 5 | K57: =SUM(E57:J57) -> 50
B58: 3 | C58: Dan Doan Trinh Anh | D58: 2 | E58: 15 | F58: 15 | G58: 12 | K58: =SUM(E58:J58) -> 42
B59: 4 | C59: Ole Bækken | D59: 3 | E59: 9 | F59: 8 | G59: 7 | H59: 6 | I59: 6 | J59: 4 | K59: =SUM(E59:J59) -> 40
B60: 5 | C60: Frode Kaveldiget | D60: 2 | E60: 15 | F60: 7 | G60: 6 | H60: 6 | I60: 4 | J60: 1 | K60: =SUM(E60:J60) -> 39
B61: 6 | C61: Frode Storli | D61: 3 | E61: 12 | F61: 9 | G61: 5 | H61: 4 | K61: =SUM(E61:J61) -> 30
B62: 7 | C62: Tom Allsted | D62: 3 | E62: 12 | F62: 10 | G62: 4 | H62: 3 | K62: =SUM(E62:J62) -> 29
B63: 8 | C63: Steinar Ormåsen | D63: 2 | E63: 12 | F63: 9 | G63: 8 | K63: =SUM(E63:J63) -> 29
B64: 9 | C64: Stein Nordstrøm | D64: 3 | E64: 12 | F64: 7 | G64: 5 | H64: 5 | K64: =SUM(E64:J64) -> 29
B65: 10 | C65: Kristian Holm | D65: 4 | E65: 10 | F65: 7 | G65: 6 | H65: 4 | I65: 2 | K65: =SUM(E65:J65) -> 29
B66: 11 | C66: Fredrik Natvik | D66: 3 | E66: 15 | F66: 12 | K66: =SUM(E66:J66) -> 27
B67: 12 | C67: Trond Nerland | D67: 2 | E67: 10 | F67: 10 | G67: 7 | K67: =SUM(E67:J67) -> 27
B68: 13 | C68: Espen Wasshaug | D68: 3 | E68: 15 | F68: 9 | K68: =SUM(E68:J68) -> 24
B69: 14 | C69: Trym Daniel Rødvik | D69: 5 | E69: 7 | F69: 7 | G69: 3 | H69: 3 | I69: 2 | J69: 1 | K69: =SUM(E69:J69) -> 23
B70: 15 | C70: Per Johnny Nygård | D70: 4 | E70: 8 | F70: 7 | G70: 6 | K70: =SUM(E70:J70) -> 21
B71: 16 | C71: Erik Feragen | D71: 3 | E71: 9 | F71: 8 | G71: 3 | K71: =SUM(E71:J71) -> 20
B72: 17 | C72: Sindre Brobakken | D72: 5 | E72: 5 | F72: 5 | G72: 3 | H72: 0 | I72: 0 | K72: =SUM(E72:J72) -> 13
B73: 18 | C73: Erlend Pilø | D73: 4 | E73: 9 | F73: 2 | G73: 0 | K73: =SUM(E73:J73) -> 11
B74: 19 | C74: Knut Engli | D74: 2 | E74: 10 | K74: =SUM(E74:J74) -> 10
B75: 19 | C75: Kai Müller | D75: 3 | E75: 10 | K75: =SUM(E75:J75) -> 10
B76: 21 | C76: Jan Børge Solbakken | D76: 2 | E76: 9 | K76: =SUM(E76:J76) -> 9
B77: 22 | C77: Trym Woldstad | D77: 5 | E77: 8 | F77: 1 | G77: 0 | K77: =SUM(E77:J77) -> 9
B78: 23 | C78: Anders Wågø | D78: 3 | E78: 8 | F78: 0 | K78: =SUM(E78:J78) -> 8
B79: 24 | C79: Lars Kr. Telle | D79: 2 | E79: 6 | K79: =SUM(E79:J79) -> 6
B80: 24 | C80: Kristoffer Opsahl | D80: 5 | E80: 6 | K80: =SUM(E80:J80) -> 6
B81: 26 | C81: Lasse Hanssen | D81: 5 | E81: 4 | K81: =SUM(E81:J81) -> 4
B82: 27 | C82: Morgan Henriksen | D82: 3 | E82: 2 | F82: 0 | K82: =SUM(E82:J82) -> 2
B83: 28 | C83: Alise Haukenes | D83: 5 | E83: 2 | K83: =SUM(E83:J83) -> 2
B84: 29 | C84: Ådne Iversen | D84: 5 | E84: 1 | F84: 0 | G84: 0 | K84: =SUM(E84:J84) -> 1
B85: 30 | C85: Reidar Kristiansen | D85: 4 | E85: 1 | K85: =SUM(E85:J85) -> 1
B86: 31 | C86: Jens Solheim | D86: 5 | E86: 3 | F86: 0 | K86: =SUM(F86:J86) -> 0
B87: 32 | C87: Tom Arnesveen | D87: 5 | E87: 0 | K87: =SUM(E87:J87) -> 0
B88: 32 | C88: Ole Henrik Saxrud | D88: 4 | E88: 0 | K88: =SUM(E88:J88) -> 0
B89: 32 | C89: Ørjan Saxrud | D89: 5 | E89: 0 | K89: =SUM(E89:J89) -> 0
B90: 32 | C90: Håkon Saxrud | D90: 5 | E90: 0 | K90: =SUM(E90:J90) -> 0
B91: 32 | C91: Simen Haugen | D91: 5 | E91: 0 | K91: =SUM(E91:J91) -> 0
B93: Gruppe inntil 1500
B95: Nr. | C95: Navn | D95: Kl. | E95: 1 | F95: 2 | G95: 3 | H95: 4 | I95: 5 | J95: 6 | K95: Poeng
B96: 1 | C96: Ole Bækken | D96: 3 | E96: 15 | F96: 12 | G96: 12 | H96: 10 | I96: 9 | J96: 9 | K96: =SUM(E96:J96) -> 67
B97: 2 | C97: Kristian Holm | D97: 4 | E97: 12 | F97: 12 | G97: 12 | H97: 9 | I97: 6 | K97: =SUM(E97:J97) -> 51
B98: 3 | C98: Trym Daniel Rødvik | D98: 5 | E98: 12 | F98: 8 | G98: 8 | H98: 7 | I98: 7 | J98: 7 | K98: =SUM(E98:J98) -> 49
B99: 4 | C99: Frode Storli | D99: 3 | E99: 15 | F99: 15 | G99: 10 | H99: 8 | K99: =SUM(E99:J99) -> 48
B100: 5 | C100: Stein Nordstrøm | D100: 3 | E100: 15 | F100: 10 | G100: 9 | H100: 9 | K100: =SUM(E100:J100) -> 43
B101: 6 | C101: Erik Feragen | D101: 3 | E101: 15 | F101: 15 | G101: 8 | K101: =SUM(E101:J101) -> 38
B102: 7 | C102: Per Johnny Nygård | D102: 4 | E102: 15 | F102: 10 | G102: 9 | K102: =SUM(E102:J102) -> 34
B103: 8 | C103: Sindre Brobakken | D103: 5 | E103: 10 | F103: 8 | G103: 7 | H103: 3 | I103: 0 | K103: =SUM(E103:J103) -> 28
B104: 9 | C104: Espen Wasshaug | D104: 3 | E104: 15 | F104: 10 | K104: =SUM(E104:J104) -> 25
B105: 10 | C105: Erlend Pilø | D105: 4 | E105: 10 | F105: 7 | G105: 3 | K105: =SUM(E105:J105) -> 20
B106: 11 | C106: Trym Woldstad | D106: 5 | E106: 9 | F106: 5 | G106: 4 | K106: =SUM(E106:J106) -> 18
B107: 12 | C107: Anders Wågø | D107: 3 | E107: 12 | F107: 4 | K107: =SUM(E107:J107) -> 16
B108: 13 | C108: Kai Müller | D108: 3 | E108: 12 | K108: =SUM(E108:J108) -> 12
B109: 14 | C109: Morgan Henriksen | D109: 3 | E109: 7 | F109: 4 | K109: =SUM(E109:J109) -> 11
B110: 15 | C110: Lars Kr. Telle | D110: 2 | E110: 10 | K110: =SUM(E110:J110) -> 10
B111: 16 | C111: Kristoffer Opsahl | D111: 5 | E111: 8 | K111: =SUM(E111:J111) -> 8
B112: 16 | C112: Alise Haukenes | D112: 5 | E112: 8 | K112: =SUM(E112:J112) -> 8
B113: 18 | C113: Ådne Iversen | D113: 5 | E113: 6 | F113: 2 | G113: 0 | K113: =SUM(E113:J113) -> 8
B114: 19 | C114: Jens Solheim | D114: 5 | E114: 6 | F114: 0 | K114: =SUM(E114:J114) -> 6
B115: 20 | C115: Lasse Hanssen | D115: 5 | E115: 6 | K115: =SUM(E115:J115) -> 6
B116: 20 | C116: Reidar Kristiansen | D116: 4 | E116: 6 | K116: =SUM(E116:J116) -> 6
B117: 22 | C117: Håkon Saxrud | D117: 5 | E117: 5 | K117: =SUM(E117:J117) -> 5
B118: 23 | C118: Simen Haugen | D118: 5 | E118: 3 | K118: =SUM(E118:J118) -> 3
B119: 24 | C119: Tom Arnesveen | D119: 5 | E119: 2 | K119: =SUM(E119:J119) -> 2
B120: 25 | C120: Ole Henrik Saxrud | D120: 4 | E120: 1 | K120: =SUM(E120:J120) -> 1
B121: 22 | C121: Ørjan Saxrud | D121: 5 | E121: 0 | K121: =SUM(E121:J121) -> 0
B123: Gruppe inntil 1250
B125: Nr. | C125: Navn | D125: Kl. | E125: 1 | F125: 2 | G125: 3 | H125: 4 | I125: 5 | J125: 6 | K125: Poeng
B126: 1 | C126: Kristian Holm | D126: 4 | E126: 15 | F126: 15 | G126: 15 | H126: 12 | I126: 10 | K126: =SUM(E126:J126) -> 67
B127: 2 | C127: Trym Daniel Rødvik | D127: 5 | E127: 15 | F127: 12 | G127: 10 | H127: 10 | I127: 10 | J127: 10 | K127: =SUM(E127:J127) -> 67
B128: 3 | C128: Per Johnny Nygård | D128: 4 | E128: 15 | F128: 15 | G128: 15 | K128: =SUM(E128:J128) -> 45
B129: 4 | C129: Sindre Brobakken | D129: 5 | E129: 12 | F129: 10 | G129: 9 | H129: 8 | I129: 5 | K129: =SUM(E129:J129) -> 44
B130: 5 | C130: Erlend Pilø | D130: 4 | E130: 15 | F130: 8 | G130: 8 | K130: =SUM(E130:J130) -> 31
B131: 6 | C131: Trym Woldstad | D131: 5 | E131: 12 | F131: 9 | G131: 9 | K131: =SUM(E131:J131) -> 30
B132: 7 | C132: Ådne Iversen | D132: 5 | E132: 7 | F132: 7 | G132: 3 | K132: =SUM(E132:J132) -> 17
B133: 8 | C133: Alise Haukenes | D133: 5 | E133: 12 | K133: =SUM(E133:J133) -> 12
B134: 8 | C134: Lars Kr. Telle | D134: 2 | E134: 12 | K134: =SUM(E134:J134) -> 12
B135: 8 | C135: Kristoffer Opsahl | D135: 5 | E135: 12 | K135: =SUM(E135:J135) -> 12
B136: 8 | C136: Reidar Kristiansen | D136: 4 | E136: 12 | K136: =SUM(E136:J136) -> 12
B137: 12 | C137: Jens Solheim | D137: 5 | E137: 7 | F137: 2 | K137: =SUM(E137:J137) -> 9
B138: 13 | C138: Lasse Hanssen | D138: 5 | E138: 8 | K138: =SUM(E138:J138) -> 8
B139: 14 | C139: Tom Arnesveen | D139: 5 | E139: 7 | K139: =SUM(E139:J139) -> 7
B140: 15 | C140: Ole Henrik Saxrud | D140: 4 | E140: 6 | K140: =SUM(E140:J140) -> 6
B141: 15 | C141: Håkon Saxrud | D141: 5 | E141: 6 | K141: =SUM(E141:J141) -> 6
B142: 17 | C142: Simen Haugen | D142: 5 | E142: 5 | K142: =SUM(E142:J142) -> 5
B143: 18 | C143: Ørjan Saxrud | D143: 5 | E143: 4 | K143: =SUM(E143:J143) -> 4
B145: Gruppe inntil 1000
B147: Nr. | C147: Navn | D147: Kl. | E147: 1 | F147: 2 | G147: 3 | H147: 4 | I147: 5 | J147: 6 | K147: Poeng
B148: 1 | C148: Trym Daniel Rødvik | D148: 5 | E148: 15 | F148: 15 | G148: 15 | H148: 15 | I148: 12 | J148: 12 | K148: =SUM(E148:J148) -> 84
B149: 2 | C149: Sindre Brobakken | D149: 5 | E149: 15 | F149: 15 | G149: 12 | H149: 10 | I149: 9 | K149: =SUM(E149:J149) -> 61
B150: 3 | C150: Ådne Iversen | D150: 5 | E150: 10 | F150: 9 | G150: 7 | K150: =SUM(E150:J150) -> 26
B151: 4 | C151: Kristoffer Opsahl | D151: 5 | E151: 15 | K151: =SUM(E151:J151) -> 15
B152: 4 | C152: Alise Haukenes | D152: 5 | E152: 15 | K152: =SUM(E152:J152) -> 15
B153: 6 | C153: Jens Solheim | D153: 5 | E153: 9 | F153: 6 | K153: =SUM(E153:J153) -> 15
B154: 7 | C154: Lars Kr. Telle | D154: 2 | E154: 12 | K154: =SUM(E154:J154) -> 12
B155: 7 | C155: Trym Woldstad | D155: 5 | E155: 12 | K155: =SUM(E155:J155) -> 12
B156: 7 | C156: Tom Arnesveen | D156: 5 | E156: 12 | K156: =SUM(E156:J156) -> 12
B157: 10 | C157: Lasse Hanssen | D157: 5 | E157: 10 | K157: =SUM(E157:J157) -> 10
B158: 11 | C158: Håkon Saxrud | D158: 5 | E158: 9 | K158: =SUM(E158:J158) -> 9
B159: 12 | C159: Ørjan Saxrud | D159: 5 | E159: 8 | K159: =SUM(E159:J159) -> 8
B160: 12 | C160: Simen Haugen | D160: 5 | E160: 8 | K160: =SUM(E160:J160) -> 8